id,question,answer
1,"1. How does the going concern assumption affect the valuation of a company?  

A. It increases the liquidation value.  
B. It decreases the intrinsic value.  
C. It assumes the company will continue operating for the foreseeable future.","C  
The correct option is C because the going concern assumption underpins valuation by assuming that the company will operate for the foreseeable future, impacting forecasts and intrinsic value positively. This assumption affects various aspects of the valuation process, including cash flow projections and discount rates, as it implies continuity and the ability to generate future cash flows."
2,"What is the primary difference between absolute and relative valuation models?  

A. Relative valuation models provide a point estimate of a stock's intrinsic value.  
B. Absolute valuation models compare a stock's value to another stock in the market.  
C. Absolute valuation models specify an asset's intrinsic value, while relative valuation models compare a stock's value to others.","C  
The correct option is C because absolute valuation models like DCF estimate intrinsic value directly, while relative models, like Price/Earnings ratios, compare the stock's value to similar stocks in the market. Understanding this difference is crucial in selecting the appropriate valuation method for a given company based on available data and the analyst's valuation purpose."
3,"When conducting a competitive analysis, what key questions should an equity analyst address?  

A. What is the company's revenue growth rate?  
B. How does the company's cost structure compare to its competitors?  
C. Are there any recent trends in the industry affecting the company's market share?","B  
The correct option is B because understanding the company's cost structure in relation to competitors provides insights into its competitive advantage or disadvantage. Analyzing factors like cost leadership or differentiation relative to industry peers helps evaluate the company's performance and potential profitability within the market."
4,"What is the significance of sum-of-the-parts valuation for conglomerate companies?  

A. It reduces the overall valuation of a conglomerate.  
B. It accounts for the separate valuation of each business segment.  
C. It combines all business segments into a single valuation metric.","B  
The correct option is B because sum-of-the-parts valuation breaks down a conglomerate's value into individual components, ensuring a more accurate representation of the company's diverse business units. By valuing each segment separately, analysts can capture the inherent value of each part, providing a better understanding of the conglomerate's total worth."
5,"How does the valuation process support stock selection by active traders?  

A. By emphasizing industry prospects over company performance.  
B. By providing a standardized approach to trading strategies.  
C. By helping identify mispriced securities for potential profit opportunities.","C  
The correct option is C because active traders rely on valuation to identify mispriced securities that offer opportunities for profit. By evaluating intrinsic value and market price discrepancies, traders can make informed decisions on buying or selling stocks based on potential over- or undervaluation in the market."
6,"What is the role of sensitivity analysis in the valuation process?  

A. To determine the impact of changes in assumptions on valuation outcomes.  
B. To compare a company's valuation to industry benchmarks.  
C. To assess the performance of different valuation models.","A  
The correct option is A because sensitivity analysis helps analysts understand how changes in key assumptions or inputs affect the final valuation results. By varying variables like revenue growth rates or discount rates, analysts can assess the robustness of their valuation models and identify the key drivers influencing the asset's value."
7,"Why is effective communication of valuation analysis important for equity analysts?  

A. To impress clients with technical jargon and complex models.  
B. To ensure stakeholders understand the rationale behind investment recommendations.  
C. To advocate for a specific valuation model without addressing alternatives.","B  
The correct option is B because clear and concise communication of valuation analysis is essential for ensuring stakeholders comprehend the basis of investment recommendations. By presenting valuation results, assumptions, and rationales in a transparent manner, equity analysts can build trust, credibility, and support for their conclusions."
8,"How does the going-concern value differ from liquidation value in the context of company valuation?  

A. Liquidation value assumes the company's continued operation, while going-concern value considers asset sell-off.  
B. Liquidation value represents a worst-case scenario, while going-concern value assumes ongoing business operations.  
C. Liquidation value disregards market conditions, while going-concern value reflects the current industry performance.","B  
The correct option is B because liquidation value pertains to asset sell-off under distress or closure scenarios, serving as a conservative estimate. In contrast, going-concern value assumes normal business operations, reflecting the company's ongoing profitability potential under stable conditions. Understanding this distinction helps analysts assess a company's value under different scenarios effectively."
9,"#11. When assessing industry and competitive analysis as part of the equity valuation process, which of the following questions should an analyst primarily address?

A. What are the company's historical earnings per share?
B. How does the company rank in terms of stock price performance compared to industry peers?
C. What are the key success factors in the industry and how does the company align with them?","C

Explanation: The primary focus of industry and competitive analysis is to identify the key success factors in the industry and evaluate how well the company aligns with those factors. Understanding the competitive landscape, industry dynamics, and the company's strategic positioning within the industry are essential for accurate valuation.

#"
10,"In the context of equity valuation models, what distinguishes a relative valuation model from an absolute valuation model?

A. Absolute valuation models use market price multiples for comparison, while relative valuation models consider intrinsic value.
B. Relative valuation models provide a point estimate of value based on fundamentals, whereas absolute valuation models assess value relative to benchmark assets.
C. Absolute valuation models value assets based on their own characteristics, while relative valuation models value assets relative to similar assets.","C

Explanation: Relative valuation models, also known as method of comparables, value assets relative to similar assets by using price multiples. In contrast, absolute valuation models, like discounted cash flow, value assets based on their own characteristics and cash flow projections.

#"
11,"When selecting an appropriate approach for valuing a company, what are the key criteria an analyst should consider?

A. The market conditions at the time of valuation and the company's short-term stock performance.
B. Consistency with analyst's opinion and the company's brand value in the market.
C. Consistency with the company's characteristics, data availability, and the purpose of the valuation.","C

Explanation: The key criteria for choosing an appropriate valuation approach include consistency with the company's characteristics, such as industry and growth prospects, data availability and quality, and alignment with the purpose of the valuation, whether for M&A, financial reporting, or investment decisions.

#"
12,"In the valuation process, what is the main purpose of forecasting company performance?

A. To predict short-term stock price movements for trading opportunities.
B. To estimate the impact of macroeconomic trends on industry growth.
C. To make projections about the company's future financial performance to derive its intrinsic value.","C

Explanation: Forecasting company performance is essential in valuation to project the company's future financials, including revenues, expenses, and cash flows, which are used to derive the company's intrinsic value through valuation models.

#"
13,"What is the primary focus of sensitivity analysis in the valuation process?

A. To analyze how changes in key assumptions affect the company's competitive positioning.
B. To assess the impact of unfavorable economic conditions on industry peers.
C. To understand how changes in key inputs impact the valuation output and overall results.","C

Explanation: Sensitivity analysis in valuation aims to analyze how changes in critical assumptions, such as revenue growth rates or discount rates, impact the final valuation output, helping analysts understand the range of potential values based on different scenarios.

#"
14,"When comparing absolute and relative valuation models, what is a key advantage of using relative valuation models?

A. Relative valuation models rely on historical financial data, providing more accurate projections.
B. Relative valuation models are easier to apply and do not require detailed company-specific forecasts.
C. Absolute valuation models are less subjective and provide precise intrinsic value estimates.","B

Explanation: Relative valuation models are easier to apply as they use market-based metrics and do not rely on detailed company-specific forecasts, making them more straightforward and practical for comparing valuation multiples.

#"
15,"How does a conglomerate discount impact the valuation of a diversified company with multiple business segments?

A. It increases the company's overall valuation due to diversification benefits.
B. It decreases the company's valuation to account for complexity and lack of focus.
C. It has no effect on the company's valuation as all segments are considered independent.","B

Explanation: A conglomerate discount decreases the valuation of a diversified company because investors may assign a lower value to a conglomerate compared to individual, focused businesses, reflecting concerns about complexity, capital allocation, and lack of synergy.

#"
16,"What is the major drawback of using purely relative valuation compared to absolute valuation in the equity analysis process?

A. Relative valuation heavily relies on macroeconomic factors and is less adaptable to industry variations.
B. Relative valuation may lead to erroneous conclusions if the chosen benchmark is fundamentally different than the firm being analyzed.
C. Relative valuation models involve complex mathematical formulas that can introduce errors in the valuation.","B

Explanation: The primary drawback of using relative valuation is that it heavily depends on the choice of comparable firms or assets. If the selected benchmark is not truly comparable to the target company, the valuation results may be inaccurate or misleading.

#"
17,"How does the discounted cash flow (DCF) approach differ from the dividend discount model (DDM) in equity valuation?

A. DCF values the company based on expected future cash flows, while DDM focuses on current dividend payouts.
B. DCF considers both cash flows and dividends, while DDM emphasizes future earnings growth.
C. DCF applies a higher discount rate to future dividends, while DDM discounts future cash flows at a constant rate.","A

Explanation: The key difference lies in the focus of each model. DCF values the company based on expected future cash flows, incorporating the entire cash flow stream, including dividends, while DDM specifically values the firm based on its current and future dividend payouts."
18,"11. Given the following scenario, in which way does Fair value differ from intrinsic value in the context of equity valuation?  

    A. Fair value is estimated without considering market conditions, whereas intrinsic value considers market factors.  
    B. Intrinsic value includes the going concern assumption, while Fair value does not.  
    C. Fair value is based on future investment returns, whereas intrinsic value relies on liquidation proceeds.  

**","B**

**Explanation:** Intrinsic value, as the name suggests, is the inherent value of an asset based on its investment characteristics and assumes a going concern, meaning the business will continue to operate. On the other hand, fair value is determined by current market conditions and reflects the price at which an asset would change hands if buyer and seller are not under compulsion and have all relevant information. Intrinsic value is a more fundamental concept compared to fair value, as it is based on the core attributes of the asset itself."
19,"How does the industry knowledge of an equity analyst contribute to the valuation process?

    A. Industry knowledge allows for immediate liquidation proceeds estimation.  
    B. It enhances the ability to forecast company performance accurately.  
    C. It is useful only in absolute valuation models and not in relative valuation models.  

**","B**

**Explanation:** Industry knowledge plays a crucial role in the valuation process by enabling analysts to understand the specific drivers, risks, and trends within an industry. This understanding enhances the accuracy of forecasts regarding company performance, competitive dynamics, and overall industry outlook, leading to more informed and precise valuation estimates. Equity analysts with deep industry knowledge can identify key factors that influence a company's value and adjust their valuation models accordingly."
20,"Which valuation model is most suitable for assessing a conglomerate with diverse business segments?

    A. Sum-of-the-parts valuation  
    B. Relative valuation model  
    C. Discounted cash flow model  

**","A**

**Explanation:** Sum-of-the-parts valuation is the most appropriate approach for valuing conglomerates with diverse business lines or segments. This method involves valuing each segment separately based on relevant valuation techniques and then aggregating these segment values to arrive at the total value of the conglomerate. It accounts for the different characteristics and growth potentials of individual business units, providing a more accurate representation of the conglomerate's overall value."
21,"When selecting an appropriate valuation approach for a given company, which criteria should an analyst consider?

    A. The personal investment bias of the analyst  
    B. The availability of peer company valuations in the market  
    C. Consistency with the analyst's valuation purpose and perspective  

**","C**

**Explanation:** When choosing a valuation approach, analysts must consider several factors, including the alignment of the approach with the specific characteristics of the company being valued, the quality and availability of data, and, most importantly, the analyst's valuation purpose and perspective. The selected approach should match the analyst's objectives, whether they are estimating intrinsic value, relative value, or applying a specific model based on the company's attributes and industry dynamics."
22,"How does a top-down forecasting approach differ from a bottom-up approach in equity valuation?

    A. The top-down approach starts with individual company forecasts, while the bottom-up approach begins with macroeconomic forecasts.  
    B. In the top-down approach, macroeconomic forecasts drive industry forecasts, while in the bottom-up approach, individual company forecasts aggregate to industry forecasts.  
    C. The top-down approach aggregates industry forecasts based on individual company forecasts, while the bottom-up approach disaggregates industry forecasts to individual company forecasts.  

**","B**

**Explanation:** The top-down forecasting approach initiates with macroeconomic projections that inform industry forecasts, which then lead to individual company forecasts. Conversely, the bottom-up method starts with detailed analyses of individual companies, which aggregate to form industry forecasts, and eventually align with macroeconomic conditions. The top-down approach focuses on broader economic trends shaping industries, while the bottom-up strategy emphasizes firm-specific factors influencing company performance."
23,"When translating forecasts into valuations, what purpose does sensitivity analysis serve?

    A. Sensitivity analysis ensures the valuation model aligns with benchmarks set by industry competitors.  
    B. It evaluates potential risks and uncertainties by examining the impact of changing assumptions on the valuation outcome.  
    C. Sensitivity analysis helps in identifying undervalued companies based on market multiples analysis.  

**","B**

**Explanation:** Sensitivity analysis is a critical component of the valuation process as it assesses the impact of varying assumptions or inputs on the final valuation output. By conducting sensitivity analysis, analysts can gauge the sensitivity of their valuation estimates to changes in key variables, helping to identify and quantify potential risks, uncertainties, and variations in valuation outcomes. It provides valuable insights into the robustness and reliability of the valuation model under different scenarios."
24,"In the context of equity valuation, what role does a control premium play when valuing a company?

    A. Control premiums adjust for the lack of marketability in a private company valuation.  
    B. They represent the premium paid for a controlling interest in a company during an acquisition.  
    C. Control premiums reflect a discount applied to illiquid securities in the valuation process.  

**","B**

**Explanation:** A control premium refers to the additional amount a buyer is willing to pay for a controlling interest in a company compared to the price for a non-controlling interest. This premium accounts for the benefits associated with controlling the strategic decisions, governance, and operations of the company. In the context of acquisitions, acquirers often pay a control premium to gain full control over the acquired firm and realize synergies, operational improvements, or strategic advantages."
25,"How does the concept of liquidity discounts impact the valuation of illiquid securities?

    A. Liquidity discounts increase the value of illiquid securities to compensate for the lack of marketability.  
    B. They reflect adjustments made to account for the higher market demand of illiquid securities.  
    C. Liquidity discounts reduce the value of illiquid securities due to the limited ability to sell them quickly in the market.  

**","C**

**Explanation:** Liquidity discounts are applied to illiquid securities to reflect the reduced value attributed to assets that cannot be promptly sold or converted into cash without significantly affecting their price. These discounts acknowledge the limited marketability and increased risks associated with illiquid investments, resulting in lower valuations to adjust for the lack of immediate liquidity in the investment. Investors often demand a higher return for holding illiquid securities due to the lack of readily available buyers or sellers in the market."
26,"How do financial analysts contribute to the investment process by employing valuation models?

    A. Analysts utilize valuation models to predict short-term market movements efficiently.  
    B. Valuation models assist analysts in interpreting corporate financial statements more accurately.  
    C. By using valuation models, analysts can gauge the intrinsic value of assets and identify mispriced securities.  

**","C**

**Explanation:** Financial analysts play a crucial role in the investment process by employing various valuation models to estimate the intrinsic value of assets and securities accurately. Valuation models help analysts assess the fair worth of investments based on fundamental factors, market conditions, and growth prospects, enabling them to identify opportunities where market prices deviate from the estimated intrinsic values. By utilizing valuation models, analysts can determine whether securities are overvalued or undervalued, aiding investors in making informed decisions regarding their investment strategies and portfolio allocations."
27,"In the context of equity valuation, how does the going concern assumption differ from the liquidation value concept?

    A. The going concern assumption considers the market price of a security, while liquidation value focuses on long-term investment returns.  
    B. Going concern implies the continued operation of a company, whereas liquidation value assumes the cessation of business activities and asset sales.  
    C. The going concern assumption reflects short-term fluctuations in stock prices, while liquidation value accounts for steady, long-term growth prospects.  

**","B**

**Explanation:** The going concern assumption in equity valuation assumes that a business will continue its operations indefinitely, with the focus on sustainable growth and earnings potential. Conversely, the liquidation value concept contemplates the scenario in which a company ceases operations and its assets are sold off, often resulting in a lower value than the going concern value due to the costs and discounts associated with asset liquidation. Going concern valuation reflects the ongoing value creation capacity of a business, while liquidation value represents the worth of assets if they were sold off in an orderly manner."
28,"11. When considering the valuation process for a company, which step involves analyzing industry prospects, competitive position, and corporate strategies?

A. Selecting the appropriate valuation model  
B. Forecasting company performance  
C. Understanding the business","C

Explanation: Understanding the business in the valuation process includes evaluating industry prospects, competitive position, and corporate strategies. This step is crucial as it contributes to making more accurate forecasts and selecting the right valuation model. Without a clear understanding of the business environment, it is challenging to make informed decisions about the company's value."
29,"In valuation, what is the main difference between intrinsic value and liquidation value?

A. Intrinsic value considers immediate liquidation proceeds, while liquidation value does not  
B. Liquidation value is based on the assumption of a going concern, whereas intrinsic value is not  
C. Intrinsic value incorporates future investment returns, while liquidation value does not","C

Explanation: Intrinsic value is based on variables related to future investment returns, while liquidation value represents the company's value if it were dissolved and its assets sold individually, without considering future returns. Intrinsic value incorporates the going concern assumption, while liquidation value assumes a forced sale of assets."
30,"Which type of valuation model provides a point estimate of an asset's value that can be compared with the market price?

A. Relative valuation models  
B. Discounted cash flow models  
C. Absolute valuation models","C

Explanation: Absolute valuation models specify an asset's intrinsic value, which provides a specific estimate of value that can be compared to the market price. Examples include discounted cash flow models that calculate the present value of expected cash flows to determine the asset's intrinsic worth."
31,"When conducting an industry and competitive analysis as part of equity valuation, what is essential to address?

A. Industry growth rate only  
B. Competitive advantage and barriers to entry  
C. Brand recognition and marketing strategies","B

Explanation: In conducting an industry and competitive analysis, it is crucial to address elements such as the company's competitive advantage, barriers to entry in the industry, differentiation strategies, and market positioning. Understanding these factors helps in assessing the company's long-term prospects and competitive position."
32,"Which valuation approach is based on comparing a stock's price multiple to a benchmark price multiple?

A. Discounted cash flow  
B. Sum-of-the-parts valuation  
C. Method of comparables","C

Explanation: The method of comparables is a relative valuation approach that involves comparing a stock's price multiple (e.g., P/E ratio) to a benchmark price multiple derived from similar assets or a group of comparable companies. This method helps in determining whether a stock is overvalued or undervalued relative to its peers."
33,"In valuation analysis, what is the purpose of sensitivity analysis?

A. To adjust for control premiums  
B. To determine the impact of changes in key inputs on the outcome  
C. To account for illiquidity discounts","B

Explanation: Sensitivity analysis is used to determine how changes in key assumptions or inputs would affect the outcome of a valuation analysis. By varying critical variables, analysts can assess the robustness of their valuation results and understand the potential impact of different scenarios on the asset's value."
34,"Sum-of-the-parts valuation is primarily used for companies that:  

A. Operate in a single industry with no diversification  
B. Have multiple business segments or subsidiaries with different valuations  
C. Have highly liquid assets only","B

Explanation: Sum-of-the-parts valuation is commonly applied to companies with diverse business segments or subsidiaries that have unique valuation characteristics. By valuing each part separately and then aggregating them, analysts can account for the varying value contributions of different segments within the overall company."
