id,question,answer
35,"When selecting the appropriate valuation approach for a company, what are the key criteria to consider?

A. Consistency with analyst's opinion only  
B. Availability of quality data and analyst's purpose  
C. Consistency with current market trends","B

Explanation: When choosing a valuation approach, analysts should consider factors like the company's characteristics, the availability and quality of data, and the specific purpose of the valuation. The approach selected should align with the nature of the company being valued and support the intended use of the valuation results."
36,"In equity valuation, what is the primary purpose of issuing fairness opinions?

A. To provide a comprehensive analysis of market trends  
B. To evaluate corporate governance practices  
C. To assess the fairness of a transaction or offer price","C

Explanation: Fairness opinions are issued to assess and ensure the fairness of a specific transaction, such as mergers, acquisitions, or other corporate actions. It involves evaluating whether the price, terms, and conditions of the transaction are fair from a financial point of view to the affected parties, such as shareholders."
37,"When communicating valuation conclusions in a research report, what is one of the essential elements that should be included?

A. Future market predictions only  
B. Internal inconsistencies in the data  
C. Risk factors associated with the investment","C

Explanation: In a research report, it is crucial to include risk factors associated with the investment to provide a comprehensive assessment to the readers. By disclosing potential risks and uncertainties, analysts can help investors make informed decisions and understand the potential downside of the investment."
38,"11. The intrinsic value of an asset is influenced by various factors. Which of the following factors is NOT typically considered when estimating intrinsic value?

A. Market price fluctuations
B. Future investment returns
C. Liquidation proceeds","A
Explanation: Market price fluctuations are the result of supply and demand dynamics in the market and are not directly factored into the calculation of intrinsic value. Intrinsic value is based on fundamental characteristics and future cash flows of the underlying asset."
39,"A financial analyst is using a relative valuation model to estimate the value of a company. Which of the following is a key advantage of relative valuation models compared to absolute valuation models?

A. Dependent on accurate forecasts of cash flows
B. Easily comparable across different industries
C. Not influenced by market sentiment","B
Explanation: Relative valuation models, such as price multiples, are advantageous in that they allow for the comparison of a company's valuation to similar companies in the industry, making them easily comparable across different sectors. This can provide insights into relative overvaluation or undervaluation."
40,"When evaluating a company's industry and competitive analysis, which of the following questions should a financial analyst address?

A. How does the company's stock price compare to the industry average?
B. What are the company's short-term profitability targets?
C. How is the company positioned relative to its competitors?","C
Explanation: Understanding how a company is positioned relative to its competitors is a key aspect of analyzing industry and competitive dynamics. This analysis helps assess a company's competitive advantage, market share, and strategic positioning within the industry."
41,"Which of the following statements accurately describes the purpose of a fairness opinion issued by financial analysts?

A. To provide a guarantee of future stock performance
B. To evaluate the fairness of a transaction for all parties involved
C. To predict the future growth potential of a company","B
Explanation: A fairness opinion is typically issued by financial analysts to evaluate the fairness of a proposed transaction, such as a merger or acquisition, for all parties involved. It assesses whether the terms of the deal are reasonable and fair from a financial perspective."
42,"An analyst is forecasting company performance and needs to consider macroeconomic factors. In a top-down approach, which of the following is the correct sequence of forecasting?

A. Individual company forecasts, industry forecasts, macroeconomic forecasts
B. Macroeconomic forecasts, industry forecasts, individual company forecasts
C. Industry forecasts, macroeconomic forecasts, individual company forecasts","B
Explanation: In a top-down forecasting approach, the sequence starts with macroeconomic forecasts, followed by industry forecasts, and then individual company forecasts. This hierarchical approach helps capture the broad economic trends that influence specific industries and companies."
43,"Sensitivity analysis is an important component of the valuation process. What does sensitivity analysis help financial analysts assess?

A. The company's debt levels
B. The impact of changes in assumptions on valuation outcomes
C. Stock price volatility","B
Explanation: Sensitivity analysis allows financial analysts to assess how changes in key assumptions, such as growth rates or discount rates, impact the valuation outcomes. It helps identify the sensitivity of the valuation model to various inputs and assumptions."
44,"When conducting a sum-of-the-parts valuation, what does the analyst typically aim to evaluate?

A. Combined value of all assets held by the company
B. Value of a company based on its industry multiples
C. Stock price fluctuations over a given period","A
Explanation: In a sum-of-the-parts valuation, the analyst aims to evaluate the combined value of all the individual parts or segments of a company. This approach breaks down the company into its different business units to assess their individual worth."
45,"What role does industry knowledge play in the equity valuation process?

A. It has minimal impact on the accuracy of valuation models
B. It helps in understanding industry-specific trends and competitive dynamics
C. Industry knowledge is only relevant for absolute valuation models","B
Explanation: Industry knowledge plays a crucial role in the equity valuation process as it helps financial analysts understand industry-specific trends, competitive dynamics, and key drivers that impact a company's valuation. This knowledge enhances the accuracy and relevance of valuation models."
46,"In the valuation process, what is the primary purpose of applying situational adjustments?

A. To manipulate financial statements for a more favorable valuation
B. To adjust for changes in market conditions or specific circumstances
C. To verify the accuracy of historical financial data","B
Explanation: Situational adjustments are applied in the valuation process to account for changes in market conditions or specific circumstances that may impact the valuation of a company. These adjustments help ensure that the valuation reflects the current and relevant factors affecting the business."
47,"How does a financial analyst determine the appropriateness of a valuation model for a given company?

A. By solely relying on historical financial data
B. By selecting a model based on popularity in the industry
C. By considering the company's characteristics, data availability, and valuation purpose","C
Explanation: The appropriateness of a valuation model for a given company is determined by considering factors such as the company's characteristics, data availability, and the specific valuation purpose. Analysts need to choose a model that aligns with the unique features of the company and the objectives of the valuation."
48,"1. What identifies the main difference between the FCFF and FCFE valuation approaches?
   A. The ownership perspective implicit in FCFE
   B. The use of net income as the base in FCFF calculations
   C. The application of market multiples in FCFE models","A
Explanation: The main difference between FCFF and FCFE valuation approaches is the ownership perspective. FCFF represents the cash flows available to all investors in a firm, while FCFE represents the cash flows available to equity investors after all obligations have been met. FCFF is from the perspective of all financing sources, while FCFE is specific to common equity holders."
49,"How does the FCFF valuation model estimate the value of a firm?
   A. Summing the future cash flows discounted at the weighted average cost of capital (WACC)
   B. Using the market capitalization to derive the equity value
   C. Estimating FCFE and discounting them at required return on equity","A
Explanation: The FCFF valuation model estimates the value of a firm by summing the future cash flows (FCFF) discounted at the weighted average cost of capital (WACC). This approach accounts for the firm's overall cost of capital and the value generated by all capital providers."
50,"What information is essential to calculate FCFE directly from net income?
   A. Non-cash charges (NCC) and net capital expenditures
   B. Operating cash flow and total debt outstanding
   C. Assets and liabilities from the balance sheet","A
Explanation: To calculate FCFE directly from net income, analysts must consider factors such as non-cash charges (NCC) and net capital expenditures. These adjustments are necessary to convert accounting-based net income into the cash flow available for distribution to equity holders."
51,"In which scenario would a financial analyst most likely use a two-stage FCFF valuation model?
   A. When the cash flow stream is expected to fluctuate significantly in the forecast period
   B. When the firm's growth rate is constant over a long period of time
   C. When the firm only has short-term debt obligations","A
Explanation: A two-stage FCFF valuation model is typically used when the cash flow stream is expected to fluctuate significantly over the forecast period. This model allows for a more flexible approach in capturing the changing dynamics of the firm's cash flows."
52,"How can changes in leverage impact future FCFF and FCFE?
   A. Higher leverage may increase future FCFE due to interest tax shields
   B. Lower leverage results in a higher WACC, impacting FCFF positively
   C. Changes in leverage have no direct impact on FCFF or FCFE","A
Explanation: Changes in leverage can impact future FCFF and FCFE. Higher leverage may increase future FCFE due to interest tax shields, which reduce taxable income and increase cash flow available to equity holders."
53,"What is the key purpose of calculating free cash flow to equity (FCFE)?
   A. To estimate the cash available for distribution to common equity shareholders
   B. To calculate total debt outstanding for the firm
   C. To evaluate the firm's short-term liquidity position","A
Explanation: The main purpose of calculating FCFE is to estimate the cash flow available for distribution to common equity shareholders. FCFE represents the cash flow remaining after all obligations, including debt and preferred dividends, have been met."
54,"When valuing common equity using the discounted free cash flow model, what is subtracted from the estimated firm value?
   A. The value of non-common-stock capital (usually debt)
   B. Total assets of the firm
   C. Cash and cash equivalents","A
Explanation: When valuing common equity using the discounted free cash flow model, the value of non-common-stock capital (usually debt) is subtracted from the estimated firm value to arrive at an estimate of the value of equity."
55,"Why do analysts often consider free cash flow models more useful than dividend discount models (DDMs)?
   A. Free cash flows provide an economically sound basis for valuation
   B. DDMs are not applicable to companies with fluctuating cash flows
   C. Free cash flows align with short-term profits, leading to more accurate valuations","A
Explanation: Analysts often consider free cash flow models more useful than DDMs because free cash flows provide an economically sound basis for valuation. They represent the cash flows available for distribution and investment, offering a comprehensive view of a firm's financial health."
56,"How does the FCFF valuation approach differ from the FCFE valuation approach in terms of ownership perspective?
   A. FCFF represents the cash flow available to all investors, while FCFE represents cash flow available to equity shareholders
   B. FCFE includes debt financing in the cash flows, while FCFF excludes it
   C. FCFF considers retained earnings, while FCFE only accounts for dividends paid","A
Explanation: The key difference in ownership perspective between the FCFF and FCFE valuation approaches is that FCFF represents the cash flow available to all investors in the company, while FCFE represents the cash flow available specifically to equity shareholders."
57,"How can a financial analyst use the residual income approach within discounted cash flow analysis?
    A. By subtracting the required return on equity from net income to calculate residual income
    B. By valuing equity as the present value of future residual income and considering book value
    C. By discounting residual income at the weighted average cost of capital to derive firm value","B
Explanation: A financial analyst can use the residual income approach within discounted cash flow analysis by valuing equity as the present value of future residual income. This approach involves calculating the excess of net income over a capital charge, representing the value generated above the required return."
58,"11. In the context of valuing a company, what is the main difference between free cash flow to the firm (FCFF) and free cash flow to equity (FCFE)?

A. FCFF considers all cash flows available to both debt and equity holders, while FCFE focuses only on cash flows available to equity holders.
B. FCFF represents cash flows after all expenses including interest and taxes, while FCFE is net cash available to common shareholders.
C. FCFF is affected by changes in financial leverage, whereas FCFE considers cash flows irrespective of capital structure changes.","A
Explanation: FCFF accounts for cash flows available to both debt and equity holders, thus reflecting the entire firm's cash-generating potential. On the other hand, FCFE considers cash flows available solely to equity holders after servicing debt needs."
59,"How does forecasting future free cash flows differ from forecasting future dividend payments in valuation analysis?

A. Free cash flow forecasting requires incorporating changes in net working capital and capital expenditures, unlike dividend payment forecasting.
B. Dividend forecasting primarily focuses on the company's retained earnings, while free cash flow forecasting is based on projected earnings.
C. Free cash flow forecasting does not involve estimating future cash needs for reinvestment, which is crucial in dividend forecasting.","A
Explanation: Forecasting free cash flows necessitates adjusting for changes in investment needs like net working capital and capital expenditures, which is not a primary consideration in forecasting dividend payments."
60,"When valuing equities, why do analysts prefer using free cash flow (FCFF or FCFE) over dividend discount models (DDMs)?

A. Free cash flow models are less complex and, therefore, easier to apply than dividend discount models.
B. Free cash flows provide a more economically sound basis for valuation than dividends as they reflect the company's ability to generate cash.
C. Dividend discount models often overestimate the true value of a stock compared to free cash flow-based methods.","B
Explanation: Analysts prefer using free cash flow as it provides a more accurate reflection of a company's value and its ability to generate cash compared to focusing solely on dividend payments."
61,"In a scenario where a company has high growth potential but does not pay dividends, which valuation approach is more likely to be suitable?

A. Dividend discount model (DDM)
B. Discounted cash flow model (DCF) using FCFE
C. Discounted cash flow model (DCF) using FCFF","C
Explanation: In cases where dividends are not paid, the FCFF model is more appropriate as it captures all cash flows available to both equity and debt holders, aligning better with the company's high-growth potential."
62,"How does changes in leverage affect future FCFF and FCFE differently in valuation analysis?

A. Increasing leverage leads to higher FCFF but reduces FCFE due to additional interest costs.
B. Decreasing leverage increases both FCFF and FCFE by reducing debt-related expenses.
C. Changes in leverage do not impact FCFF or FCFE as these measures are independent of a company's capital structure.","A
Explanation: Altering a company's leverage affects FCFF and FCFE differently since changes in leverage can impact interest costs, leading to a higher FCFF but reducing FCFE."
63,"When using net income and EBITDA as cash flow proxies in valuation, what common issue should analysts be cautious of?

A. Double-counting expenses in the calculation of net income and EBITDA.
B. Ignoring key cash flow components that affect net income and EBITDA.
C. Incorrectly equating net income and EBITDA with actual cash flows available for valuation purposes.","C
Explanation: Net income and EBITDA may not fully align with actual cash flows available for valuation, so using them as direct proxies may lead to inaccuracies."
64,"How can a financial analyst determine whether a stock is overvalued, fairly valued, or undervalued based on a free cash flow valuation model?

A. By comparing the stock's current market price with its book value per share.
B. By discounting the company's future free cash flows at the cost of equity to derive a present value per share.
C. By analyzing the company's revenue growth projections relative to industry benchmarks.","B
Explanation: An analyst can determine the valuation status of a stock by discounting its future free cash flows at the cost of equity to derive an estimated present value per share, enabling a comparison with the current market price."
65,"When evaluating a company's value using free cash flow models, why is sensitivity analysis important?

A. Sensitivity analysis helps in determining the impact of various input variables on the company's intrinsic value.
B. Sensitivity analysis allows analysts to calculate the exact percentage increase in free cash flows year over year.
C. Sensitivity analysis assists in gauging market sentiment towards the company's stock performance relative to competitors.","A
Explanation: Conducting sensitivity analysis enables analysts to understand how changes in key input variables affect the company's intrinsic value, providing insights into potential risks and variations in valuation output."
66,"In the context of multistage valuation models, what is the primary purpose of calculating the terminal value?

A. To estimate the total industry value and identify potential M&A opportunities.
B. To determine the final cash flow amount at the end of the projection period for comprehensive valuation.
C. To capture the value of a company beyond the explicit forecast period and account for perpetual cash flows.","C
Explanation: Calculating the terminal value in multistage models allows for capturing the value of a company beyond the explicit forecast period by considering perpetual cash flows, essential in achieving a comprehensive valuation picture."
67,"11. When comparing the free cash flow to equity (FCFE) approach to the free cash flow to the firm (FCFF) approach, which of the following statements is correct?

A. FCFE considers cash flows available to common stockholders, while FCFF considers cash flows available to all investors.
B. FCFE can be negative, while FCFF is always positive.
C. FCFE is typically used to value the entire firm, while FCFF is used specifically to value equity shares.","A
Explanation: The correct statement is that FCFE considers cash flows available to common stockholders, while FCFF considers cash flows available to all investors. FCFE represents the cash flows available to equity holders after considering debt holders, preferred shareholders, and other capital providers. On the other hand, FCFF represents the cash flows available to all investors in a company, including both equity and debt holders."
68,"How do changes in leverage impact future free cash flow to equity (FCFE)?

A. Increased leverage generally leads to higher FCFE due to tax shields.
B. Decreased leverage reduces the financial risk but does not impact FCFE.
C. Higher leverage can decrease FCFE by increasing interest payments and financial risk.","C
Explanation: Higher leverage increases interest payments, which can reduce FCFE as more cash flow is used to service debt obligations. Additionally, higher leverage increases financial risk, which can impact the stability and predictability of future cash flows to equity."
69,"Which of the following adjustments to earnings before interest and taxes (EBIT) would be most likely made to calculate FCFF?

A. Adding back depreciation and non-cash charges.
B. Deducting taxes from EBIT.
C. Excluding interest expenses from EBIT.","A
Explanation: To calculate FCFF, adjustments such as adding back depreciation and other non-cash charges are typically made to EBIT to convert it to a cash flow measure. Depreciation is a non-cash expense that reduces net income but does not impact cash flows."
70,"In the context of free cash flow valuation models, how do analysts typically forecast future free cash flows?

A. By assuming constant growth rates in perpetuity.
B. By estimating sales, profitability, investments, and financing based on future expectations.
C. By using historical cash flow data exclusively without any future projections.","B
Explanation: Analysts generally forecast future free cash flows by estimating various factors such as sales growth, profitability margins, capital investments, and financing needs based on expected future economic conditions and company-specific factors."
71,"When estimating a company’s value using a free cash flow model, why are net income and EBITDA considered unreliable proxies for cash flow?

A. Net income and EBITDA do not account for interest expenses.
B. They may double-count or ignore certain cash flow components.
C. Both net income and EBITDA incorporate adjustments for non-cash items.","B
Explanation: Net income and EBITDA are not direct measures of cash flow and can result in inaccurate valuation estimates as they may double-count certain cash flow components or ignore important aspects of the cash flow stream, leading to unreliable valuation outcomes."
72,"How is the present value of future FCFF calculated using the weighted average cost of capital (WACC)?

A. By summing all future FCFF values without discounting.
B. By discounting each year's FCFF at the cost of equity.
C. By discounting each year's FCFF at the WACC.","C
Explanation: The present value of future FCFF is calculated by discounting each year's FCFF at the weighted average cost of capital (WACC), which represents the required return on the overall capital of the company, including both equity and debt."
73,"In the context of free cash flow valuation models, what does it mean for a stock to be considered undervalued?

A. The stock price is lower than its book value per share.
B. The stock is trading at a premium relative to its industry peers.
C. The estimated intrinsic value of the stock exceeds its current market price.","C
Explanation: When a stock is considered undervalued, it means that the estimated intrinsic value of the stock, as determined by a free cash flow valuation model, exceeds its current market price. This indicates the potential for the stock price to increase in the future."
74,"What factor would lead an analyst to use the free cash flow to equity (FCFE) approach over the dividend discount model (DDM)?

A. The company has a stable dividend payment history.
B. The company has a complex capital structure with varying debt levels.
C. The company's earnings are not a reliable indicator of future cash flows.","C
Explanation: If a company's earnings are not a reliable indicator of future cash flows, an analyst may choose to use the FCFE approach over the DDM as FCFE provides a more direct measure of cash available to equity holders, especially in cases where earnings do not align with cash flow generation."
75,"How does a two-stage free cash flow valuation model differ from a single-stage constant growth model?

A. Two-stage models assume varying growth rates over distinct time periods.
B. Single-stage models account for changes in discount rates over time.
C. Two-stage models consider only short-term cash flow forecasts.","A
Explanation: Two-stage free cash flow valuation models involve assuming different growth rates over two distinct time periods, usually short-term and long-term growth phases. In contrast, a single-stage constant growth model assumes a steady, constant growth rate in perpetuity without distinct phases."
76,"11. Which of the following statements accurately describes the discounted cash flow (DCF) valuation approach?
    A. DCF model values a security based on its historical cash flows.
    B. DCF model views the intrinsic value of a security as the future cash flows discounted at the cost of equity.
    C. DCF model solely relies on industry multiples for valuation.","B
    Explanation: The DCF valuation approach values a security as the present value of its expected future cash flows discounted at the appropriate discount rate, such as the cost of equity or the weighted average cost of capital (WACC). This model looks into the intrinsic value of a security based on its future cash flow potential rather than historical cash flows."
