id,question,answer
77,"When valuing equities using the discounted free cash flow model, why do analysts often prefer using the FCFF approach over the FCFE approach?
    A. FCFF requires estimating the equity risk premium.
    B. FCFF aligns well with companies that do not pay dividends.
    C. FCFE is more commonly used due to its simplicity in calculations.","B
    Explanation: Analysts often prefer using the FCFF (Free Cash Flow to the Firm) approach over the FCFE (Free Cash Flow to Equity) approach when valuing equities because FCFF aligns well with companies that do not pay dividends or have significant differences between actual dividends paid and capacity to pay dividends. FCFF is seen as a better representation of the company's potential cash flows available for all investors, including equity and debt holders."
78,"In the context of forecasting future free cash flows, what does it mean when an analyst uses a multistage free cash flow valuation model?
    A. This model assumes a constant growth rate in FCFF or FCFE over multiple stages.
    B. This model adjusts for industry-specific risk factors in estimating future cash flows.
    C. This model accounts for varying growth rates and business dynamics over different future periods.","C
    Explanation: A multistage free cash flow valuation model accounts for varying growth rates and business dynamics over different future periods. Unlike a single-stage model that assumes a constant growth rate, a multistage model captures the changing nature of a company's operations and growth rates over time."
79,"How does calculating free cash flow to equity (FCFE) differ from calculating free cash flow to the firm (FCFF)?
    A. FCFE deducts interest expense from FCFF to arrive at equity-specific cash flows.
    B. FCFE adds net borrowing to FCFF to account for equity investors' cash inflows.
    C. FCFE includes non-cash items like depreciation and amortization in its calculation.","B
    Explanation: Calculating Free Cash Flow to Equity (FCFE) involves adjusting Free Cash Flow to the Firm (FCFF) by adding net borrowing while deducting interest expense. FCFE focuses on cash flows available to common equity shareholders after accounting for cash inflows related to net borrowing activities."
80,"When assessing a stock's valuation using the free cash flow model, how does sensitivity analysis play a crucial role?
    A. Sensitivity analysis relies on historic cash flows to project future values accurately.
    B. Sensitivity analysis helps identify how changes in key assumptions impact the estimated intrinsic value.
    C. Sensitivity analysis is only applicable in the context of discounted dividend models.","B
    Explanation: Sensitivity analysis is vital in free cash flow valuations as it allows analysts to understand the impact of changing key assumptions, such as growth rates or discount rates, on the estimated intrinsic value of the stock. This analysis helps in assessing the robustness and reliability of the valuation model under varying scenarios."
81,"Which financial statement line item is typically used as the starting point to calculate Free Cash Flow to the Firm (FCFF)?
    A. Net Income
    B. Earnings Before Interest and Taxes (EBIT)
    C. Cash Flow from Operations (CFO)","B
    Explanation: Earnings Before Interest and Taxes (EBIT) is often used as the starting point to calculate Free Cash Flow to the Firm (FCFF) as it represents the company's earnings before accounting for interest and taxes, making it a suitable proxy for cash flow available for all providers of capital."
82,"In a two-stage Free Cash Flow to Equity (FCFE) valuation model, what is a common characteristic of the second stage?
    A. Declining growth rate resembling the maturity phase of the business.
    B. Higher growth rate reflecting short-term business expansion.
    C. Constant growth rate reflecting stable operations over the long term.","A
    Explanation: In a two-stage FCFE valuation model, the second stage often exhibits a declining growth rate, resembling the mature phase of the business where growth stabilizes. This declining growth rate model assumes that the company transitions from high growth to a more stable growth phase."
83,"What adjustment is made to Free Cash Flow to the Firm (FCFF) to calculate Free Cash Flow to Equity (FCFE)?
    A. Adding net borrowings and deducting interest expense.
    B. Deducting net borrowing and adding interest expense.
    C. Subtracting dividends paid to shareholders.","A
    Explanation: The adjustment made to Free Cash Flow to the Firm (FCFF) to calculate Free Cash Flow to Equity (FCFE) involves adding net borrowing while deducting interest expense. This adjustment accounts for the cash flows specific to equity investors after considering the company's borrowing activities."
84,"How do market analysts typically use net income and EBITDA in the context of free cash flow valuation?
    A. They replace cash flow measures with net income to simplify calculations.
    B. They adjust net income and EBITDA for non-cash expenses to derive free cash flow.
    C. They consider net income and EBITDA as direct proxies for free cash flow.","B
    Explanation: Market analysts often adjust net income and EBITDA for non-cash expenses and working capital changes to derive free cash flow in valuation models. Net income and EBITDA are not direct proxies for free cash flow as they need adjustments to accurately reflect the cash available for distribution to investors."
85,"9. How is residual income defined in the context of equity valuation models?
A. Net income plus a charge for common shareholders' opportunity cost.
B. Net income less a charge for common shareholders' opportunity cost.
C. Total revenue minus total expenses.","B
Explanation: Residual income in equity valuation models is calculated as net income minus a charge (deduction) for common shareholders' opportunity cost in generating net income. This concept recognizes the costs of all the capital used in generating income after deducting equity capital's cost."
86,"In the context of residual income, why is it important to consider the costs of all of a company's capital?
A. To minimize tax liabilities.
B. To calculate the CEO's compensation.
C. To accurately assess the company's value and profitability.","C
Explanation: Considering the costs of all the capital used in generating income is crucial in residual income models to accurately assess a company's value and profitability. This approach helps investors understand if a company is adding value for shareholders by earning more than its cost of capital."
87,"How is residual income used in valuing common stock?
A. As a fixed figure added to the current stock price.
B. As the difference between the required rate of return and forecasted earnings per share.
C. As a component in determining the intrinsic value of a share of common stock.","C
Explanation: Residual income is used in valuing common stock as a crucial component in determining the intrinsic value of a share of common stock. It is added to the current book value per share to calculate the intrinsic value, reflecting the expected future per-share residual income."
88,"How does residual income differ from traditional accounting measures like net income?
A. Residual income considers all capital costs; net income does not.
B. Net income focuses on cash flows; residual income focuses on equity value.
C. Residual income is a non-GAAP measure; net income is a GAAP measure.","A
Explanation: Residual income differs from traditional accounting measures like net income in that residual income considers all capital costs, including the cost of equity capital, while net income does not explicitly include the cost of equity capital in its calculation. Residual income provides a more comprehensive view of a company's value creation for shareholders."
89,"11. How does residual income differ from traditional accounting measures like net income in the context of equity valuation?

A. Residual income considers the cost of equity capital, while net income does not.
B. Residual income includes interest expenses, unlike net income.
C. Residual income ignores the opportunity cost of shareholders.","A
Explanation: Residual income deducts the cost of equity capital, which represents the opportunity cost for common shareholders, from net income to reflect the value generated above what equity investors require. This adjustment helps in more accurately evaluating a company's performance in adding value for its shareholders. Net income, on the other hand, does not account for the cost of equity capital."
90,"In residual income valuation, if a company's actual net income exceeds its residual income, what does this indicate?

A. The company is undervalued.
B. The company is overvalued.
C. The company is accurately valued.","B
Explanation: If a company's actual net income exceeds its residual income, it suggests that the company may be overvalued. This occurs when the company is not generating enough income above the cost of equity capital to justify its current valuation based on residual income calculations."
91,"How can an analyst calculate the intrinsic value of a common stock using the single-stage residual income model?

A. By adding the book value per share to the present value of expected future per-share residual income.
B. By adding together the forecasted earnings per share.
C. By multiplying the stock price by the return on equity.","A
Explanation: In the single-stage residual income model, the intrinsic value of a common stock is determined by summing the current book value per share with the present value of expected future per-share residual income. This method accounts for the income generated above the cost of equity over an extended period."
92,"What is the significance of calculating the implied growth rate in residual income based on the market price-to-book ratio and the required rate of return on equity?

A. It helps in determining the company's profitability.
B. It assists in assessing the stock's intrinsic value relative to its current market price.
C. It indicates the company's market share potential.","B
Explanation: Calculating the implied growth rate in residual income is crucial as it provides insights into how the market price-to-book ratio and the required rate of return on equity are influencing the stock's valuation. It aids in understanding if the stock is overvalued or undervalued based on the expected growth rate reflected in the market price."
93,"When comparing residual income models to dividend discount models, what is a key advantage of the residual income approach?

A. Residual income models are simpler to calculate.
B. Residual income models explicitly consider the cost of equity capital.
C. Residual income models are suitable for short-term investments only.","B
Explanation: A key advantage of residual income models over dividend discount models is that residual income explicitly accounts for the cost of equity capital, offering a more comprehensive view of a company's value creation beyond just dividends. This consideration results in a more accurate assessment of a company's performance in generating shareholder value."
94,"In the context of residual income valuation, why is it important to evaluate continuing residual income at the forecast horizon?

A. To determine the company's total revenue.
B. To assess the company's long-term growth potential.
C. To estimate the value the company is expected to create beyond the forecast period.","C
Explanation: Evaluating continuing residual income at the forecast horizon is essential in residual income valuation to estimate the value a company is anticipated to generate beyond the forecasted period. This factor provides insights into the company's long-term sustainability and its ability to create ongoing value for shareholders."
95,"How does residual income valuation differ from free cash flow models in assessing a company's stock value?

A. Residual income models focus on future dividend payments, while free cash flow models consider capital expenditures.
B. Residual income models consider both equity and debt financing, while free cash flow models focus solely on equity.
C. Residual income models explicitly account for the cost of equity capital, while free cash flow models do not.","C
Explanation: Residual income valuation differs from free cash flow models primarily in that residual income models explicitly incorporate the cost of equity capital in determining the intrinsic value of a stock, whereas free cash flow models do not directly address the cost of equity. This distinction makes residual income models more specific to evaluating shareholder value creation."
96,"What is a potential weakness of residual income models compared to dividend discount models in stock valuation?

A. Residual income models do not consider companies with high volatility.
B. Residual income models may be more biased towards short-term performance.
C. Residual income models can be sensitive to the accuracy of forecasting future earnings.","C
Explanation: A potential weakness of residual income models compared to dividend discount models is their sensitivity to the accuracy of forecasting future earnings. Since residual income models rely heavily on forecasting expected earnings and equity charges, inaccuracies in these predictions can significantly impact the calculated intrinsic value of a stock."
97,"When justifying the selection of a residual income model for valuing a company's common stock, what criteria should be considered by the analyst?

A. The company's market capitalization.
B. The company's dividend payout ratio.
C. The strengths and weaknesses of the residual income model relative to other valuation methods.","C
Explanation: When justifying the selection of a residual income model for valuing a company's common stock, the analyst should consider the strengths and weaknesses of the residual income model in comparison to other valuation methods. Understanding the advantages and limitations of the residual income approach helps in determining its suitability for assessing a particular company's stock value."
98,"How can an analyst evaluate whether a stock is overvalued, fairly valued, or undervalued based on a residual income model?

A. By comparing the company's market share to industry averages.
B. By assessing the divergence between the stock's market price and its intrinsic value.
C. By analyzing the company's revenue growth over the past year.","B
Explanation: An analyst can determine whether a stock is overvalued, fairly valued, or undervalued using a residual income model by evaluating the difference between the stock's market price and its calculated intrinsic value. If the market price exceeds the intrinsic value, the stock may be overvalued; if they are relatively close, the stock is likely fairly valued; and if the market price is below the intrinsic value, the stock may be undervalued."
99,"11. Which of the following correctly describes residual income in the context of equity valuation models?

A. Residual income is equal to net income.
B. Residual income is the income remaining after accounting for all capital costs.
C. Residual income does not consider any deductions for opportunity costs.","B

Explanation: Residual income, in the context of equity valuation models, represents the income that remains after deducting all capital costs, including the cost of equity capital. It is a key concept in understanding economic profit and shareholder value creation."
100,"When applying the residual income model for valuing common stock, what does a positive residual income indicate?

A. The stock is overvalued.
B. The company is creating economic value for shareholders.
C. The stock should be sold immediately.","B

Explanation: A positive residual income indicates that the company is generating more income than the cost of its equity capital, implying that it is creating economic value for its shareholders. In this case, the stock may be considered undervalued based on the residual income model."
101,"How does residual income valuation differ from traditional accounting-based valuation methods?

A. Residual income valuation does not consider future earnings potential.
B. Residual income valuation explicitly accounts for the cost of equity capital.
C. Residual income valuation relies solely on historical financial data.","B

Explanation: Residual income valuation differs from traditional accounting-based methods by explicitly incorporating the cost of equity capital, allowing for a more holistic assessment of a company's value creation potential from its capital investments."
102,"In a two-stage residual income valuation model, what does the continuing residual income in the second stage represent?

A. The company's book value.
B. The residual income beyond the forecast horizon.
C. The dividends paid to shareholders.","B

Explanation: The continuing residual income in the second stage of a two-stage model represents the residual income that is expected to persist beyond the initial forecast horizon, reflecting the company's ongoing value creation potential."
103,"How does the concept of economic value added (EVA) relate to residual income models?

A. EVA is another term for residual income.
B. EVA measures a company's value creation similarly to residual income.
C. EVA does not consider the cost of capital.","B

Explanation: EVA and residual income models both aim to measure a company's value creation by considering the costs of all capital employed. EVA is a commercial implementation of the residual income concept that emphasizes economic profit."
104,"When calculating the intrinsic value of a common stock using the residual income model, what is the significance of the required rate of return on equity?

A. It represents the historical performance of the stock.
B. It reflects the cost of equity capital to the company.
C. It determines the future earnings growth rate of the stock.","B

Explanation: The required rate of return on equity in the residual income model reflects the cost of equity capital to the company, which is essential for assessing the stock's intrinsic value based on its ability to generate returns above this cost."
105,"In the context of residual income models, how does the return on equity (ROE) impact the calculated residual income?

A. Higher ROE leads to lower residual income.
B. ROE is not a factor in calculating residual income.
C. Higher ROE contributes positively to residual income.","C

Explanation: A higher return on equity (ROE) positively contributes to residual income as it indicates the company's ability to generate more income relative to its equity capital, enhancing shareholder value creation."
106,"When comparing residual income models to dividend discount models, what is a key advantage of using residual income models?

A. Residual income models are more focused on short-term earnings.
B. Residual income models explicitly consider the cost of equity capital.
C. Residual income models do not require forecasting future cash flows.","B

Explanation: A key advantage of residual income models over dividend discount models is that they explicitly incorporate the cost of equity capital, providing a more comprehensive and dynamic approach to valuing common stock."
107,"How can an analyst determine if a stock is overvalued, fairly valued, or undervalued using the residual income model?

A. By comparing the stock price to historical averages.
B. By assessing the company's revenue growth rate.
C. By comparing the calculated intrinsic value to the current market price.","C

Explanation: An analyst can determine if a stock is overvalued, fairly valued, or undervalued by comparing the calculated intrinsic value derived from the residual income model to the stock's current market price, enabling informed investment decisions based on the perceived value proposition."
108,"In the context of residual income valuation, what role does the concept of economic profit play?

A. Economic profit represents accounting profits without any deductions.
B. Economic profit is synonymous with residual income.
C. Economic profit reflects the true value creation for equity holders beyond accounting profit.","C

Explanation: Economic profit in residual income valuation signifies the true value creation for equity holders by considering all capital costs. It offers a more robust measure of a company's profitability and wealth generation potential relative to traditional accounting profit metrics."
109,"11. In the context of residual income models, how is economic value added (EVA) calculated and what does it signify?

    A. EVA is calculated as Net Income minus Equity Charge and represents the firm's profit after considering all capital costs.
    
    B. EVA is calculated as Gross Revenue minus Operating Expenses and represents the firm's operational efficiency.
    
    C. EVA is calculated as Total Assets minus Total Liabilities and represents the firm's financial health.","A
    Explanation: Economic Value Added (EVA) is calculated as Net Income minus Equity Charge. EVA represents the wealth generated by a business, taking into account all of the costs thrown into generating it, including the total cost of capital. EVA is a measure of how effectively a company utilizes its capital to generate profits. It indicates whether the company is creating economic value above its cost of capital."
110,"When using a residual income model for valuing common stock, how is the intrinsic value calculated, and what does it signify?

    A. The intrinsic value is calculated as the Book Value per share only.
    
    B. The intrinsic value is calculated as the Present Value of future residual income per share in addition to Book Value per share.
    
    C. The intrinsic value is calculated as the Historical Earnings per share minus the cost of equity.","B
    Explanation: In a residual income model, the intrinsic value of a common stock is calculated as the sum of the Book Value per share and the Present Value of expected future per-share residual income. This represents the expected value of the stock based on the company's profitability and the return on equity compared to the cost of equity."
111,"How does residual income valuation differ from free cash flow models?

    A. Residual income valuation considers profits after all expenses, while free cash flow focuses on cash available to distribute.
    
    B. Residual income valuation excludes the cost of equity, while free cash flow models incorporate all capital costs.
    
    C. Residual income valuation includes only tangible assets, while free cash flow models consider both tangible and intangible assets.","A
    Explanation: Residual income valuation considers profits after all expenses, including equity costs, reflecting the firm's ability to generate wealth for shareholders. In contrast, free cash flow models focus on the cash available for distribution to all capital providers, including debt and equity holders."
112,"When estimating the intrinsic value of a common stock using the residual income model, why is the required rate of return on equity crucial?

    A. The required rate of return helps determine the stock's market value.
    
    B. The required rate of return adjusts for the stock's volatility.
    
    C. The required rate of return reflects the opportunity cost of equity capital invested in the stock.","C
    Explanation: The required rate of return on equity is crucial in the residual income model as it reflects the opportunity cost of equity capital. It represents the minimum return that equity investors require given the stock's risk and market conditions."
113,"In the context of residual income models, explain the concept of continuing residual income and its importance in valuations.

    A. Continuing residual income occurs when a company consistently earns below its cost of equity.
    
    B. Continuing residual income represents the expected residual income beyond the forecast horizon and is vital in determining the terminal value.
    
    C. Continuing residual income signifies net income that fades out over time as the firm matures.","B
    Explanation: Continuing residual income in residual income models refers to the expected residual income beyond the forecast horizon. It is used to estimate the terminal value of a stock and measures the persistent income that the firm can generate in the long term."
114,"How does the concept of economic profit relate to residual income models, and what value does it add to equity valuation?

    A. Economic profit measures accounting profit after deducting explicit and implicit costs, enhancing the accuracy of valuations.
    
    B. Economic profit highlights the economic value added by a firm, aligning with the principles of residual income models.
    
    C. Economic profit indicates the total revenue minus total expenses, providing a holistic view of a company's financial health.","B
    Explanation: Economic profit, which measures the value generated after deducting all costs, aligns with the principles of residual income models. It emphasizes the wealth created by a firm above its cost of capital, serving as a vital component in equity valuations."
