id,question,answer
43,"In the context of equity valuation, what is fair value defined as?

A. The market price at a given point in time
B. The price at which an asset would change hands in a forced sale
C. The price at which an asset would exchange between knowledgeable parties under no compulsion","C

Explanation: Fair value represents the price at which an asset would exchange between well-informed parties in an arm’s length transaction, without compulsion to buy or sell. It reflects a reasonable estimate of the asset's true worth based on market conditions."
44,"When conducting an industry and competitive analysis for equity valuation, what key questions should an analyst address?

A. How to maximize shareholder value through dividend payouts
B. What are the key success factors in the industry and who are the main competitors
C. How to assess the company's accounting practices for financial reporting","B

Explanation: An industry and competitive analysis involves understanding key industry factors, competitive dynamics, market structure, and identifying main competitors and their strategies. This analysis helps in assessing the company's position relative to industry peers."
45,"Which valuation approach provides a point estimate of an asset's intrinsic value for comparison with market prices?

A. Sum-of-the-parts valuation
B. Relative valuation model
C. Absolute valuation model","C

Explanation: Absolute valuation models offer a specific estimate of an asset's intrinsic value based on its fundamentals and future cash flows, allowing for direct comparison with market prices to assess potential mispricing."
46,"What is the main distinction between absolute and relative valuation models in equity analysis?

A. Absolute models use comparable company data for valuation
B. Relative models include discounted cash flow analysis
C. Absolute models provide a specific intrinsic value estimate","C

Explanation: The primary difference lies in the output generated; absolute valuation models calculate a specific intrinsic value for the asset, whereas relative valuation models determine the asset's value relative to similar assets or market benchmarks."
47,"When choosing an appropriate valuation approach for a company, what criteria should an analyst consider?

A. Only consider the popularity of the approach among industry analysts
B. Select an approach based on availability of data and conformance with analyst's viewpoint
C. Always choose the approach with the highest complexity for accuracy","B

Explanation: Analysts should consider if the chosen valuation approach aligns with the company's characteristics, data availability, and the analyst's perspective, ensuring relevance and suitability in reflecting the company's true value."
48,"How do analysts convert forecasts into valuations in equity analysis?

A. By comparing company performance to industry benchmarks
B. By applying discounts and premiums based on forecast sensitivity
C. By using quantitative models to estimate future cash flows and discount them","C

Explanation: Analysts convert future forecasts into valuations by utilizing quantitative models such as discounted cash flow models to estimate expected cash flows over time and discount them back to present value, incorporating risk factors and growth assumptions."
49,"In the context of equity valuation, what is the purpose of sensitivity analysis?

A. To identify undervalued companies based on their market price
B. To assess the impact of changes in input assumptions on valuation outcomes
C. To calculate the market value of a company's intangible assets","B

Explanation: Sensitivity analysis helps analysts understand how changes in key assumptions or inputs affect the final valuation results, providing insights into the robustness and reliability of the valuation model under different scenarios."
50,"What are some critical components of an effective research report in which equity analysts communicate their valuation analysis?

A. Including speculative opinions without factual basis
B. Distinguishing between value investing and growth investing strategies
C. Providing clear recommendations, risk factors, and disclosing potential conflicts of interest","C

Explanation: An effective research report should contain clear recommendations based on valuation analysis, disclose relevant risk factors, distinguish between facts and opinions, and transparently address any potential conflicts of interest to ensure ethical and professional communication with investors."
51,"1. What is the primary difference between the FCFF and FCFE approaches to valuation?
   
A. FCFF considers all investors' claims, while FCFE considers only equity holders.
B. FCFF includes short-term investments, while FCFE focuses on long-term investments.
C. FCFF discounts cash flows at the cost of equity, while FCFE uses the weighted average cost of capital (WACC).","A

Explanation: The correct option is A because the FCFF approach values the entire firm by considering the cash flows available to all investors (both debt and equity holders), while FCFE values only the equity portion by considering cash flows available to equity holders after satisfying all other claims."
52,"When applying a two-stage FCFF valuation model, what does the residual income represent in the equation?
   
A. The excess of FCFF in the terminal year over the terminal cash flows.
B. The difference between equity value and debt value.
C. The additional cash flow generated from non-operating assets.","A

Explanation: The correct option is A because the residual income in a two-stage FCFF valuation model typically represents the excess of FCFF in the terminal year over the terminal cash flows to account for the continuing value beyond the explicit forecast period."
53,"How are FCFF and FCFE related to each other in terms of their calculation method?
   
A. FCFE equals FCFF minus interest plus net borrowing.
B. FCFE equals FCFF plus interest minus net borrowing.
C. FCFE equals FCFF minus net borrowing plus dividends.","A

Explanation: The correct option is A because FCFE is derived from FCFF by subtracting the after-tax interest expenses and adding back net borrowing to account for the cash flow available to equity holders."
54,"When using a three-stage FCFF model, what assumption is made about the cash flows in each stage?
   
A. They are dependent on different market conditions.
B. They have a constant growth rate within each stage.
C. They require additional funding from external sources.","B

Explanation: The correct option is B because a three-stage FCFF model assumes that cash flows have a constant growth rate within each stage but may vary between stages based on changing business conditions."
55,"How does the value of equity differ when using the FCFF and FCFE approaches in valuation?
   
A. Equity value from FCFF includes non-common-stock capital, while FCFE excludes it.
B. Equity value from FCFE considers all stakeholder claims, while FCFF focuses only on equity holders.
C. Equity value derived from FCFF is based on market multiples, while FCFE values equity using free cash flows.","A

Explanation: The correct option is A because the value of equity derived from FCFF involves subtracting non-common-stock capital (often debt) from the firm's total value, whereas FCFE represents the value available exclusively to equity shareholders."
56,"11. When comparing the free cash flow to the firm (FCFF) and free cash flow to equity (FCFE) approaches to valuation, which of the following statements is accurate?

A. FCFF accounts for all capital providers, while FCFE accounts only for equity shareholders.
B. FCFE includes debt interest payments, whereas FCFF does not consider debt-related expenses.
C. FCFF is typically lower than FCFE due to the inclusion of interest expenses.","A

Explanation: FCFF takes into account the cash flows available to all capital providers, including both debt and equity holders. On the other hand, FCFE focuses solely on the cash flows available to equity shareholders after accounting for debt obligations. Therefore, FCFF encompasses a broader perspective of the company's cash flow allocation compared to FCFE."
57,"How do dividends, share repurchases, share issues, and changes in leverage impact future FCFF and FCFE?

A. Share repurchases increase both FCFF and FCFE by reducing the number of outstanding shares.
B. Dividends increase both FCFF and FCFE by distributing excess cash to shareholders.
C. Increases in leverage reduce FCFE by raising interest payment obligations, whereas FCFF remains unaffected.","A

Explanation: Share repurchases reduce the number of outstanding shares, thus increasing earnings per share and subsequently both FCFF and FCFE without changing the available cash flow. Dividends, on the other hand, reduce the company's cash balance and hence impact both FCFF and FCFE directly."
58,"Which valuation approach aligns better with profitability within a reasonable forecast period when the company pays dividends?

A. Dividend discount model (DDM)
B. FCFF model
C. FCFE model","A

Explanation: The dividend discount model (DDM) better aligns with profitability within a reasonable forecast period when the company pays dividends since it values the equity explicitly based on expected dividend payments. FCFF and FCFE models focus on cash flows rather than dividends."
59,"In the context of free cash flow valuation models, how can an analyst determine if a stock is overvalued, fairly valued, or undervalued?

A. By comparing the forecasted FCFF to the historical income of the company.
B. By calculating the present value of forecasted free cash flows and comparing it to the current stock price.
C. By evaluating the company's market multiples against industry benchmarks.","B

Explanation: Analysts can determine if a stock is overvalued, fairly valued, or undervalued by calculating the present value of forecasted free cash flows using an appropriate model (such as FCFF or FCFE) and comparing it to the current market price of the stock. If the calculated value is higher than the market price, the stock may be undervalued, and vice versa."
60,"Which of the following adjustments are required to calculate FCFF starting from EBITDA?

A. Add back depreciation and subtract changes in working capital and capital expenditures.
B. Deduct taxes and interest expenses after tax from EBITDA.
C. Subtract dividends paid to common shareholders from EBITDA.","B

Explanation: To calculate FCFF from EBITDA, one would typically deduct taxes and interest expenses (after tax) from EBITDA to arrive at FCFF. EBITDA does not account for taxes and interest, which are important factors in assessing the firm's free cash flow available to all providers of capital."
61,"What is the key ownership perspective implicit in the FCFE approach to valuation?

A. FCFE focuses on cash available for debt obligations rather than equity shareholders.
B. FCFE values the equity based on the residual cash flow after satisfying other capital providers.
C. FCFE prioritizes dividend payments over reinvestment in company operations.","B

Explanation: The key ownership perspective implicit in the Free Cash Flow to Equity (FCFE) approach is that it values the equity stake based on the residual cash flow after meeting the obligations to debt holders and other capital providers. FCFE focuses on the cash available specifically to equity shareholders after all other capital claims are satisfied."
62,"How can sensitivity analysis be useful in FCFF and FCFE valuations?

A. Sensitivity analysis helps determine the impact of changes in key assumptions on the valuation outcome.
B. Sensitivity analysis focuses on historical data rather than future projections.
C. Sensitivity analysis is not relevant in free cash flow valuations.","A

Explanation: Sensitivity analysis is vital in FCFF and FCFE valuations as it allows analysts to assess the impact of variations in key assumptions (such as growth rates, discount rates, or terminal values) on the valuation results. By conducting sensitivity analysis, analysts can better understand the uncertainties and risks associated with their valuation models."
63,"When using the two-stage free cash flow valuation models, what does the value of the firm at the end of stage 1 typically represent?

A. The terminal value of the company in a stable growth phase.
B. The residual cash flows generated beyond the forecasted period.
C. The present value of forecasted cash flows leading up to the terminal value.","A

Explanation: In two-stage free cash flow valuation models, the value of the firm at the end of stage 1 usually signifies the terminal value of the company in a stable growth phase. It denotes the worth of the firm beyond the initial forecasted period, where the cash flows are assumed to grow at a stable rate indefinitely."
64,"How do analysts typically calculate FCFF and FCFE when starting with net income?

A. By adding non-cash charges like depreciation and subtracting net capital expenditures.
B. By adding back interest expenses and changes in working capital to net income.
C. By adjusting for tax benefits and interest payments from net income.","B

Explanation: When deriving FCFF and FCFE from net income, analysts commonly start by adding back interest expenses (net of tax, for FCFF) and adjusting for changes in working capital along with net capital expenditures. These adjustments are necessary to convert accounting profit into free cash flow measures that reflect the actual cash available to providers of capital."
65,"In the context of FCFF and FCFE valuations, why is it essential to segregate non-operating assets from operating assets?

A. Operating and non-operating assets have different risk profiles that affect the cost of capital.
B. Non-operating assets can distort the true value of the firm if included in the cash flow projections.
C. Non-operating assets do not generate cash flows and should not be considered in valuations.","B

Explanation: It is crucial to segregate non-operating assets from operating assets in FCFF and FCFE valuations because non-operating assets, such as excess cash or non-core investments, can obscure the true operating performance of the company. Including non-operating assets in cash flow projections may distort the valuation results by inflating the perceived cash flows available to equity holders."
66,"11. When valuing equity securities using the free cash flow to equity (FCFE) approach, what does the required rate of return on equity (r) typically represent?
   
   A. The Weighted Average Cost of Capital (WACC)
   
   B. The return required by common stockholders
   
   C. The cost of debt financing
   
   **","B**
   
   Explanation: The required rate of return on equity (r) in the FCFE approach represents the return that common stockholders require on their investment in the company. This rate reflects the risk associated with investing in the company's equity securities and is used to discount future free cash flows to equity."
67,"In a two-stage FCFE valuation model, what does the second stage typically assume about the growth rate of free cash flows to equity (FCFE)?
   
   A. The growth rate slows down significantly
   
   B. The growth rate accelerates rapidly
   
   C. The growth rate remains constant indefinitely
   
   **","A**
   
   Explanation: In a two-stage FCFE valuation model, the second stage usually assumes that the growth rate of FCFE slows down significantly compared to the initial growth phase. This more conservative assumption reflects a maturing business that moves into a stable growth phase."
68,"How might an increase in leverage affect future free cash flows to the firm (FCFF) and free cash flows to equity (FCFE)?
   
   A. Increase FCFF and decrease FCFE
   
   B. Decrease FCFF and increase FCFE
   
   C. Increase both FCFF and FCFE
   
   **","A**
   
   Explanation: An increase in leverage typically increases the financial risk of a company, leading to higher interest payments on debt. This increase in interest expense will reduce the cash flow available to both equity and debt holders. Therefore, an increase in leverage is likely to increase FCFF (as less cash is available for all investors) and decrease FCFE (as more cash is used to service debt)."
69,"What role does the concept of terminal value play in free cash flow (FCF) valuation models?
   
   A. It estimates the value of a company's assets at the end of its useful life
   
   B. It represents the value of the company beyond the explicit forecast period
   
   C. It calculates the present value of future cash flows only up to a certain point in time
   
   **","B**
   
   Explanation: Terminal value in FCF valuation models represents the value of the company beyond the explicit forecast period. It is typically determined by applying a perpetuity growth rate to the cash flows at the end of the forecast period to capture the ongoing value of the company's cash flows in perpetuity."
70,"When using the dividend discount model (DDM) and the FCFE model to value a company, which of the following statements is true?
   
   A. The DDM focuses on cash flows available to both equity and debt holders
   
   B. The FCFE model is more suitable for companies with stable dividend payouts
   
   C. Both models rely on expected future cash flows to determine the value of equity
   
   **","C**
   
   Explanation: Both the DDM and the FCFE model rely on expected future cash flows to determine the value of equity. While the DDM focuses specifically on dividend payments, the FCFE model considers all cash flows available to equity holders, including dividends, share repurchases, and other adjustments."
71,"How does the presence of non-operating assets impact the valuation of a company's equity using free cash flow models?
   
   A. Non-operating assets are excluded from the valuation as they do not generate cash flows
   
   B. Non-operating assets are valued separately and then subtracted from the firm value
   
   C. Non-operating assets are included in the valuation as part of the firm's operating cash flows
   
   **","B**
   
   Explanation: Non-operating assets, such as excess cash or non-core investments, are typically valued separately from a company's operating assets in free cash flow models. The value of these non-operating assets is calculated independently and then subtracted from the overall firm value to determine the value of equity."
72,"In a discounted cash flow (DCF) analysis using the free cash flow to the firm (FCFF) model, which of the following components is not deducted from the operating income to calculate FCFF?
   
   A. Interest Expense
   
   B. Net Capital Expenditure
   
   C. Non-cash Depreciation
   
   **","A**
   
   Explanation: In the FCFF model, interest expense is added back to operating income (after tax) to calculate FCFF, as interest is considered a financing cash flow rather than an operating cash flow. Net capital expenditure and non-cash depreciation are deducted from operating income to arrive at FCFF."
73,"Why do analysts often use market multiples in addition to discounted cash flow (DCF) models for equity valuation?
   
   A. Market multiples provide a simpler and more accurate valuation method than DCF models
   
   B. DCF models may be more sensitive to assumptions and require more detailed forecasts
   
   C. Market multiples are preferred by investors and provide a more intuitive valuation perspective
   
   **","B**
   
   Explanation: Analysts often use market multiples alongside DCF models because market multiples, based on comparable company valuations, provide a complementary perspective to DCF models. Market multiples can offer a simpler valuation approach and are less sensitive to specific assumptions and forecasts compared to DCF models."
74,"How does the ownership perspective differ between the free cash flow to the firm (FCFF) and free cash flow to equity (FCFE) approaches in valuation?
   
   A. FCFF focuses on cash flows available to all investors while FCFE focuses only on equity shareholders
   
   B. FCFF is used when the company pays no dividends, while FCFE is used when dividends align with profitability
   
   C. FCFF represents the residual cash flows to equity after meeting debt obligations, while FCFE includes all cash flows before debt servicing
   
   **","A**
   
   Explanation: The ownership perspective in valuation distinguishes between FCFF, which focuses on the cash flows available to all investors (both equity and debt holders), and FCFE, which specifically considers the cash flows available to equity shareholders. FCFF reflects the cash flows before any capital structure considerations, while FCFE represents the cash flows remaining for equity investors after meeting all obligations."
75,"When evaluating whether a stock is overvalued, fairly valued, or undervalued based on a free cash flow valuation model, what key aspect do analysts consider to make their assessment?
   
   A. Historical stock performance relative to market benchmarks
   
   B. Market sentiment and investor behavior
   
   C. Comparison of the calculated intrinsic value to the market price
   
   **","C**
   
   Explanation: In free cash flow valuation models, analysts assess whether a stock is overvalued, fairly valued, or undervalued by comparing the calculated intrinsic value based on the model to the current market price of the stock. If the intrinsic value is higher than the market price, the stock may be considered undervalued, and vice versa."
76,"11. In valuation, what is the key difference between the Free Cash Flow to the Firm (FCFF) and Free Cash Flow to Equity (FCFE) approaches?

A. FCFF includes cash flows available to all investors and debt holders, while FCFE only considers cash flows available to equity shareholders.
B. FCFF discounts cash flows at the weighted average cost of capital (WACC), whereas FCFE discounts cash flows at the cost of equity.
C. FCFF values the equity of the firm directly, while FCFE values the firm first before subtracting non-common-stock capital.","A
Explanation: The key difference between FCFF and FCFE lies in the recipients of the cash flows. FCFF represents the cash flows available to all investors and debt holders of the firm, including equity and debt holders. On the other hand, FCFE focuses solely on the cash flows available to equity shareholders after all other investors and debt holders have been paid."
77,"How do changes in dividend policy, share repurchases, and leverage impact future Free Cash Flow to the Firm (FCFF) and Free Cash Flow to Equity (FCFE)?

A. Increasing dividends increases FCFF and decreases FCFE, while increasing leverage decreases both FCFF and FCFE.
B. Share repurchases reduce FCFF and increase FCFE, while a decrease in leverage decreases FCFF and increases FCFE.
C. Decreasing dividends decreases both FCFF and FCFE, while issuing new shares increases FCFF and decreases FCFE.","A
Explanation: Changes in dividend policy, share repurchases, and leverage have specific impacts on FCFF and FCFE. Increasing dividends generally increase FCFF as more cash is available to all investors and debt holders, while decreasing FCFE as less cash flows to equity shareholders. Additionally, increasing leverage can reduce both FCFF and FCFE due to higher interest payments and financial risk associated with debt."
78,"When valuing common equity using the Free Cash Flow to Equity (FCFE) approach, how is the value of equity calculated specifically?

A. Equity value = Present value of future FCFEs discounted at the cost of equity
B. Equity value = Present value of future FCFFs discounted at the weighted average cost of capital
C. Equity value = Future FCFE multiplied by the cost of equity","A
Explanation: In the FCFE approach, the value of equity is calculated by finding the present value of future Free Cash Flows to Equity (FCFE) discounted at the cost of equity. This method values common equity directly based on the cash flows available to equity shareholders."
79,"Which of the following statements accurately describes the relationships between FCFF, FCFE, and Net Income (NI) when calculating cash flows?

A. FCFF is equal to NI plus non-cash charges and interest expenses, while FCFE is NI minus net borrowing.
B. FCFF is NI plus net borrowing and tax savings, while FCFE is FCFF adjusted for depreciation and changes in working capital.
C. FCFE is NI plus non-cash charges and interest expenses, while FCFF is FCFE plus interest expenses and tax effects.","A
Explanation: When calculating cash flows, FCFF typically starts with Net Income (NI) and adds back non-cash charges, interest expenses (1 - Tax rate), less capital expenditures (FCInv), and working capital investments. FCFE, on the other hand, usually starts from NI and adjusts for net borrowing, capital expenditures, and working capital investments."
80,"What is the primary advantage of using Free Cash Flow (FCF) models over Dividend Discount Models (DDM) in equity valuation?

A. FCF models account for cash flows available to all investors, not just equity shareholders.
B. FCF models are based on actual cash flows, making them more accurate for valuation.
C. DDM models provide a clearer link between cash flows and equity value compared to FCF models.","B
Explanation: The primary advantage of using FCF models over DDM is that FCF models are based on actual cash flows available to all investors, making them more accurate and comprehensive for valuation purposes. FCF models use free cash flows that represent the cash available for distribution or reinvestment, providing a clearer picture of a company's financial health."
