id,question,answer
122,"When using residual income models, how are abnormal earnings or economic profit typically interpreted?

    A. Excess earnings above zero profit
    B. Returns generated beyond the cost of capital
    C. Reduction in net income due to operating losses","B

    Explanation: Abnormal earnings or economic profit in residual income models represent returns that exceed the cost of capital, indicating value creation for shareholders. It reflects the profits generated by a company beyond what is required to satisfy the capital providers, signaling positive economic value added."
123,"What distinguishes residual income models from price-multiple approaches in equity valuation?

    A. Residual income models focus on historical earnings
    B. Price-multiple approaches rely on forward-looking projections
    C. Residual income models incorporate the cost of all capital used","C

    Explanation: The key distinction between residual income models and price-multiple approaches lies in the treatment of capital costs. Residual income models explicitly account for all capital costs, including equity, providing a more comprehensive assessment of economic value creation compared to price-multiple approaches that often rely on market-based multiples."
124,"11. Which of the following best describes the concept of residual income in equity valuation models?

A. Residual income is the same as net income.
B. Residual income is net income minus the cost of all capital utilized.
C. Residual income is not relevant for equity valuation.","B

Explanation: Residual income, in equity valuation models, represents the income remaining after deducting the cost of all capital utilized in generating that income. It is a key component in assessing the value creation by a company beyond just its accounting profits."
125,"In the context of the residual income model, how is intrinsic value calculated for common stock?

A. Intrinsic value is calculated as book value per share.
B. Intrinsic value is the sum of book value per share and the present value of future residual income.
C. Intrinsic value is based solely on the company's net income.","B

Explanation: The intrinsic value of common stock in the residual income model is determined by adding the book value per share to the present value of expected future residual income. This method takes into account both the historical value and the anticipated future value generated by the company."
126,"How does the concept of economic value added (EVA) relate to residual income in financial analysis?

A. EVA is the same as residual income.
B. EVA is a commercial adaptation of residual income, emphasizing value creation.
C. EVA is not relevant in financial analysis.","B

Explanation: Economic value added (EVA) is a commercial implementation of the residual income concept focusing on measuring value creation beyond traditional accounting metrics. It underscores the economic profit generated by a company after considering all costs of capital."
127,"When comparing residual income models to dividend discount models and free cash flow models, what is a key strength of the residual income approach?

A. Residual income models do not consider future earnings.
B. Residual income models explicitly account for the cost of equity capital.
C. Residual income models are less precise in estimating intrinsic value.","B

Explanation: A major strength of residual income models is their explicit inclusion of the cost of equity capital, providing a more comprehensive assessment of value creation compared to other models that may overlook this crucial factor."
128,"How does the two-stage residual income model differ from the single-stage model in estimating the intrinsic value of common stock?

A. The two-stage model does not consider future residual income.
B. The two-stage model accounts for continuing residual income beyond the forecast horizon.
C. The single-stage model is more accurate than the two-stage model.","B

Explanation: In the two-stage residual income model, the intrinsic value calculation incorporates continuing residual income beyond the initial forecast period, reflecting the long-term value creation potential of the company compared to the single-stage model."
129,"In a situation where a financial analyst uses the residual income model to value a company's common stock, how can the implied growth rate in residual income be calculated?

A. Implied growth rate equals the market price-to-book ratio.
B. Implied growth rate equals the required rate of return on equity.
C. Implied growth rate can be derived from the market price-to-book ratio and the required rate of return on equity.","C

Explanation: The implied growth rate in residual income can be ascertained by comparing the market price-to-book ratio to the estimated required rate of return on equity, helping analysts understand the market's growth expectations embedded in the stock price."
130,"What fundamental determinants are essential to consider when applying the residual income model for equity valuation?

A. Only net income and total capital employed.
B. Return on equity and earnings growth rates.
C. Industry norms and market demand fluctuations.","B

Explanation: Key fundamental determinants in residual income valuation include return on equity, reflecting profitability, and earnings growth rates, indicating the company's potential for generating future residual income."
131,"In the context of residual income valuation, why is it crucial to forecast continuing residual income at the forecast horizon?

A. Continuing residual income has no impact on the overall intrinsic value.
B. Forecasting continuing residual income helps capture the company's long-term value creation potential.
C. The forecast horizon disregards important factors in equity valuation.","B

Explanation: Forecasting continuing residual income beyond the initial horizon is essential in capturing the company's sustained value creation ability, providing a more comprehensive assessment of intrinsic value based on the company's long-term prospects."
132,"When assessing whether a stock is overvalued, fairly valued, or undervalued using a residual income model, what key factor helps in making this determination?

A. Historical stock price movements.
B. Comparison with analyst recommendations.
C. Calculating the difference between the stock price and the intrinsic value derived from the model.","C

Explanation: The difference between the stock price and the intrinsic value derived from the residual income model indicates whether a stock is overvalued (if the price is higher), fairly valued (if price equals intrinsic value), or undervalued (if the price is lower)."
133,"What role does the cost of equity capital play in residual income models, distinguishing them from traditional accounting methods?

A. The cost of equity capital is irrelevant in residual income calculations.
B. Traditional methods overlook the cost of equity capital, unlike residual income models.
C. The cost of equity capital is only used in pricing models, not valuation models.","B

Explanation: Residual income models differentiate themselves by explicitly considering the cost of equity capital, highlighting the importance of assessing value creation beyond accounting profits by incorporating all costs of capital in equity valuation."
134,"Certainly! Here is a new set of 10 questions along with their detailed answer explanations:

11. Which of the following statements accurately describes residual income in the context of equity valuation?
   
    A. Residual income is calculated as net income minus interest expenses.
    B. Residual income represents the income earned that exceeds the company's cost of equity capital.
    C. Residual income is often higher for companies with high debt levels.
    
    **","B**
   
    Explanation: Residual income is the income or profit that exceeds the equity charge, which is calculated as equity capital multiplied by the required rate of return on equity. It signifies the value creation by a company for its common shareholders after accounting for the cost of equity capital."
135,"How does the residual income model differ from dividend discount models (DDM) in valuing common stocks?

    A. Residual income models consider dividends paid out, while DDM does not.
    B. Residual income models focus on the value added beyond the required return on equity, while DDM solely values based on projected dividends.
    C. Residual income models are more suitable for mature companies, while DDM is preferred for growth companies.
    
    **","B**
    
    Explanation: The key distinction is that residual income models focus on the excess returns generated beyond the cost of equity, incorporating all capital costs. In contrast, DDM values a stock based solely on the expected dividends paid out."
136,"In the context of residual income valuation, how is continuing residual income estimated at the forecast horizon?

    A. Continuing residual income is calculated as the average residual income over the forecast period.
    B. Continuing residual income is the expected residual income after the forecast period based on the company's long-term prospects.
    C. Continuing residual income is considered zero after the forecast period ends.
    
    **","B**
    
    Explanation: Continuing residual income is estimated by assuming that the company will continue to generate excess returns beyond the forecast period based on its future performance outlook."
137,"When comparing residual income models to free cash flow models, what is a key advantage of using residual income models for equity valuation?

    A. Residual income models incorporate the cost of equity capital explicitly.
    B. Free cash flow models are more flexible in capturing future growth opportunities.
    C. Residual income models rely solely on accounting metrics rather than cash flows.
    
    **","A**
    
    Explanation: Residual income models explicitly consider the cost of equity capital, providing a more direct link between the company's financial performance and valuation."
138,"Assume a company has a positive net income but negative residual income. What does this indicate about the company's performance?

    A. The company is not generating returns above its cost of equity.
    B. The company is highly leveraged with excessive debt.
    C. The company is experiencing losses in its core operations.
    
    **","A**
    
    Explanation: Negative residual income implies that the company is not earning returns above its cost of equity capital, meaning it is not adding value for shareholders despite having positive net income."
139,"How does Economic Value Added (EVA) differ from residual income in the context of financial analysis?

    A. EVA only considers accounting profits, while residual income is a broader economic measure.
    B. EVA focuses on total capital, whereas residual income concentrates on equity capital.
    C. EVA adjusts for the cost of all capital, including debt and equity, while residual income accounts only for equity capital.
    
    **","C**
    
    Explanation: EVA considers the costs of both debt and equity capital, providing a comprehensive measure of profit after all capital costs. In contrast, residual income focuses solely on the cost of equity capital."
140,"In the context of the residual income model, what is the significance of the required rate of return on equity (cost of equity capital)?

    A. It determines the company's borrowing capacity.
    B. It represents the minimum return required by investors for holding equity in the company.
    C. It is used solely for calculating the interest expenses.
    
    **","B**
    
    Explanation: The required rate of return on equity signifies the minimum return investors expect for holding equity in the company, reflecting the cost of equity capital in the residual income model."
141,"If a company's residual income decreases over consecutive periods, how does this affect the intrinsic value of its common stock?

    A. The stock's intrinsic value will increase due to higher residual income volatility.
    B. The stock's intrinsic value will decrease as lower residual income signals weaker value creation.
    C. The stock's intrinsic value remains unaffected by changes in residual income.
    
    **","B**
    
    Explanation: A decrease in residual income typically indicates diminishing value creation, leading to a lower intrinsic value of the company's common stock."
142,"When applying residual income valuation, how is the terminal value of a stock calculated in a two-stage model?

    A. The terminal value is estimated based on the company's historical stock performance.
    B. The terminal value includes the expected future residual income beyond the forecast period.
    C. The terminal value is derived solely from the company's current book value.
    
    **","B**
    
    Explanation: In a two-stage residual income model, the terminal value incorporates the expected residual income beyond the forecast period, reflecting the company's ongoing value creation potential."
143,"How does the concept of residual income address the limitations of traditional accounting measures like net income?

    A. Residual income accounts for all capital costs, enhancing the assessment of value creation.
    B. Residual income focuses exclusively on short-term profitability metrics.
    C. Residual income neglects the impact of equity financing on a company's financial performance.
    
    **","A**
    
    Explanation: Residual income overcomes the limitation of traditional net income by deducting the cost of equity capital, providing a more comprehensive measure of a company's value creation for shareholders.

These questions cover various aspects of residual income models in equity valuation, providing a comprehensive assessment of the concepts involved."
