id,question,answer
81,"When valuing a company using Free Cash Flow to the Firm (FCFF), what is the significance of the discount rate used in the valuation process?

A. The discount rate in FCFF valuation reflects the risk associated with the company's operations.
B. The discount rate represents the cost of equity only and does not consider debt holders.
C. The discount rate is fixed and does not vary based on market conditions or changes in company strategy.","A
Explanation: The discount rate used in FCFF valuation, often the weighted average cost of capital (WACC), reflects the risk associated with the company's operations and the required return expected by both equity and debt holders. It takes into account the company's overall capital structure and represents the opportunity cost of investing in the company."
82,"In a two-stage Free Cash Flow to Equity (FCFE) valuation model, what does the stable growth stage typically represent?

A. The stable growth stage indicates a period of high growth and reinvestment in the company.
B. This stage reflects a transition phase where the company moves from high to moderate growth.
C. The stable growth stage represents a sustainable and steady growth rate for the company in the long term.","C
Explanation: In a two-stage FCFE valuation model, the stable growth stage usually signifies a sustainable and constant growth rate that the company is expected to achieve in the long term. This stage assumes that the company has matured and reached a more stable growth phase after experiencing higher growth rates in the initial growth stage."
83,"How does the use of sensitivity analysis enhance Free Cash Flow (FCF) valuations in practice?

A. Sensitivity analysis helps identify key variables that may significantly impact the valuation results.
B. Sensitivity analysis ensures the accurate calculation of discount rates for FCF models.
C. Sensitivity analysis introduces random variables to test the robustness of FCF models.","A
Explanation: Sensitivity analysis is a critical tool in FCF valuations as it helps to evaluate the impact of changes in key variables on the valuation results. By varying key inputs such as growth rates, discount rates, and terminal values, analysts can assess the sensitivity of the valuation model to different scenarios and identify the variables that have the most significant influence on the outcome."
84,"When calculating the terminal value in a multi-stage valuation model, what are the common approaches used by analysts?

A. The perpetual growth model, the liquidation value approach, and the market multiplier method.
B. Applying a constant growth rate, using industry-specific benchmarks, and considering management forecasts.
C. Estimating the terminal value based on comparables, determining a conservative growth rate, and employing scenario analysis.","A
Explanation: Common approaches used by analysts to calculate the terminal value in a multi-stage valuation model include the perpetual growth model (also known as the Gordon growth model), the liquidation value approach, and the market multiplier method. These methods help estimate the value of a company beyond the forecast period and are essential in determining the total value of the firm or equity."
85,"How do financial analysts usually handle the valuation of operating assets versus non-operating assets in the context of Free Cash Flow (FCF) models?

A. Analysts value operating assets based on future cash flows generated by the core business and value non-operating assets separately.
B. Analysts combine the valuation of operating and non-operating assets and discount them together in FCF models.
C. Analysts ignore non-operating assets as they have minimal impact on the overall valuation using FCF models.","A
Explanation: In FCF models, financial analysts typically value operating assets separately from non-operating assets. Operating assets, representing the core business activities, are valued based on the future cash flows expected to be generated. Non-operating assets, such as excess cash, marketable securities, and investments, are usually valued independently and then added to the total firm value to determine the overall valuation."
86,"11. Which approach to valuation places importance on free cash flow to the firm (FCFF) when the company does not pay dividends?

A. Discounted dividend model (DDM)
B. Market multiple valuation
C. Discounted free cash flow model","C

Explanation: The correct answer is C. When a company does not pay dividends, analysts often prefer using the discounted free cash flow model, particularly the FCFF model. FCFF provides a basis for valuation even in the absence of dividends by focusing on the cash flows available to all investors in the company rather than just common shareholders."
87,"How is equity value calculated using the free cash flow to equity (FCFE) approach?

A. FCFE divided by the number of outstanding shares
B. FCFE minus the value of the firm's debt
C. FCFE discounted at the required rate of return on equity (r)","A

Explanation: The correct answer is A. Equity value using the FCFE approach is calculated by dividing the total value of equity by the number of outstanding shares. This division gives the value per share based on the available free cash flows to equity."
88,"In valuing individual equities, which method is used more frequently than the dividend discount model (DDM) among analysts?

A. Residual income approach
B. Discounted free cash flow model
C. Market multiple valuation","B

Explanation: The correct answer is B. Among analysts valuing individual equities, the discounted free cash flow model is used more frequently than the dividend discount model (DDM). This reflects the importance analysts place on cash flow-based valuations over dividend-based methods."
89,"How does forecasting future free cash flows differ from forecasting dividends for valuation purposes?

A. Free cash flows include all cash available to both debt and equity holders
B. Dividends are solely based on the company's profitability
C. Free cash flows correlate directly with the company's stock price movements","A

Explanation: The correct answer is A. Forecasting future free cash flows involves estimating all cash available to both debt and equity holders, providing a comprehensive view of a company's financial health. In contrast, dividends are limited to the cash actually paid out as returns to shareholders."
90,"When valuing equity securities indirectly using the FCFF model, what is subtracted from the estimated value of the firm?

A. Market value of equity
B. Value of non-common-stock capital
C. Dividends paid to shareholders","B

Explanation: The correct answer is B. When valuing equity securities indirectly using the FCFF model, the value of non-common-stock capital (usually debt) is subtracted from the estimated value of the firm to arrive at an estimate of the value of equity."
91,"Why do analysts consider free cash flow models to be more useful than dividend discount models in practice?

A. Free cash flows provide a more reliable forecast of future earnings
B. Free cash flows are readily available data for most companies
C. Free cash flow models capture a broader set of cash flow dynamics compared to dividends alone","C

Explanation: The correct answer is C. Analysts often view free cash flow models as more useful than dividend discount models because free cash flows capture a broader range of cash flow dynamics that can provide a more comprehensive basis for valuation compared to focusing solely on dividends."
92,"What scenario would prompt an analyst to use free cash flow (FCFF or FCFE) over dividend-based methods for valuation?

A. When a company pays consistent and high dividends
B. When free cash flows are not aligned with company profitability
C. When an investor wants control over the cash flows of the company","C

Explanation: The correct answer is C. Analysts may choose to use free cash flow (either FCFF or FCFE) for valuation when an investor takes a control perspective and seeks discretion over the use of cash flows. In such cases, the flexibility of free cash flows aligns with an investor's control objectives."
93,"In a discounted free cash flow model, what key factor is considered in estimating the terminal value in a multistage valuation model?

A. Expected future dividend payments
B. WACC for the company
C. Long-term growth rate of free cash flows","C

Explanation: The correct answer is C. When estimating the terminal value in a discounted free cash flow model, the long-term growth rate of free cash flows is a critical factor. This growth rate influences the perpetual cash flows beyond the forecast period and impacts the overall valuation."
94,"When calculating free cash flow to equity (FCFE), which component is NOT subtracted from net income?

A. Net capital expenditure (FCInv)
B. Non-cash charges (NCC)
C. Interest expense before taxes (Int)","C

Explanation: The correct answer is C. In the calculation of FCFE, interest expense before taxes (Int) is not subtracted from net income. Instead, FCFE calculation incorporates factors such as net capital expenditure (FCInv) and non-cash charges (NCC) to capture the cash available to equity holders."
95,"How do FCFF and FCFE relate to each other in terms of calculation and components?

A. FCFE equals FCFF minus interest expenses
B. FCFE includes all cash flows available to common shareholders
C. FCFE equals FCFF minus net borrowing and interest on debt","C

Explanation: The correct answer is C. FCFE can be derived from FCFF by subtracting interest payments and adding net borrowing. This relationship highlights how changes in financing activities impact the available cash flows specifically allocated to equity shareholders in the company."
96,"1. An analyst is using a residual income model to estimate the intrinsic value of a stock. What is the key advantage of residual income models over traditional accounting measures in terms of capturing economic profit for shareholders?

A. Including a charge for the cost of equity capital
B. Excluding a charge for the cost of debt capital
C. Ignoring the opportunity costs of capital","A

Explanation: The key advantage of residual income models is that they explicitly include a charge for the cost of equity capital, which represents the opportunity cost for shareholders. Traditional accounting measures often overlook this important aspect of economic profit, making residual income models more comprehensive in capturing shareholder value."
97,"How does residual income relate to fundamental metrics like return on equity and earnings growth rates in valuation analysis?

A. Residual income increases with higher return on equity and earnings growth rates
B. Residual income decreases with higher return on equity and earnings growth rates
C. Residual income is not influenced by return on equity or earnings growth rates","A

Explanation: Residual income is positively correlated with higher return on equity and earnings growth rates. Companies generating higher returns on equity and experiencing faster earnings growth typically have higher residual income, reflecting their ability to create value for shareholders beyond the cost of equity capital."
98,"Why is residual income valuation considered an improvement over traditional valuation methods like price-multiple approaches?

A. Residual income explicitly considers the costs of all capital used in generating income
B. Traditional valuation methods focus solely on market pricing dynamics
C. Residual income models are more complex and less transparent to stakeholders","A

Explanation: Residual income valuation is considered an improvement over traditional methods because it explicitly recognizes the costs of all capital employed by a company in generating income. This comprehensive approach provides a clearer picture of economic value creation, unlike price-multiple approaches that may overlook the true cost of capital."
99,"In a residual income model, how is the intrinsic value of a stock calculated based on future residual income expectations?

A. It is the sum of the current book value per share and the present value of expected future per-share residual income
B. It is solely determined by the company's market capitalization
C. It is derived from historical earnings per share figures","A

Explanation: The intrinsic value of a stock in a residual income model is calculated as the sum of the current book value per share and the present value of expected future per-share residual income. This approach values the stock based on its accounting book value and the expected future economic profit generated beyond the cost of equity capital."
100,"How is residual income related to the concept of economic value added (EVA) in financial analysis?

A. Residual income is a component of EVA but focuses specifically on equity value
B. Residual income replaces the concept of EVA in valuation models
C. EVA and residual income are unrelated metrics in financial analysis","A

Explanation: Residual income is a measure of equity value creation after deducting the cost of equity capital, while economic value added (EVA) represents the net operating profit of a company after accounting for the total cost of capital. Residual income, therefore, is a component of EVA that focuses on equity-specific returns beyond the costs of equity capital."
101,"When forecasting per-share residual income in a residual income model, what factors are typically considered besides earnings per share and return on equity?

A. Required rate of return on equity and historical stock price movements
B. Beginning book value per share and expected future dividends
C. Dynamics of equity capital allocation and long-term growth prospects","B

Explanation: When forecasting per-share residual income, factors typically considered include the beginning book value per share (existing equity capital) and the expected future dividends or retained earnings growth that contribute to the creation of new equity capital over time. These elements influence the expected residual income generation for shareholders."
102,"In a multi-stage residual income model with continuing residual income, how is the intrinsic value of a stock calculated beyond the initial forecasting horizon?

A. It includes ongoing residual income generation and adjustments for terminal value considerations
B. It solely depends on historical performance and market trends
C. It disregards future growth prospects and focuses on current book value","A

Explanation: In a multi-stage residual income model with continuing residual income, the intrinsic value of a stock is calculated by incorporating ongoing residual income generation beyond the initial forecast horizon, alongside adjustments for terminal value considerations. This approach accounts for the long-term value creation potential of a company beyond the forecast period."
103,"What are the strengths and weaknesses of using residual income models compared to dividend discount models for stock valuation?

A. Strengths include capturing economic profit, while weaknesses involve complexity in forecasting
B. Strengths include simplicity in application, while weaknesses involve overlooking the cost of equity
C. There are no differences between residual income and dividend discount models","A

Explanation: Residual income models have strengths in capturing economic profit for shareholders and emphasizing the true cost of equity capital. However, some weaknesses may arise from the complexity of forecasting future residual income streams compared to the more straightforward application of dividend discount models."
104,"11. In residual income models, what does the equity charge represent?
A. The cost of equity capital
B. The interest expense
C. The operating income","A
Explanation: The equity charge in residual income models represents the cost of equity capital, which is the required rate of return on equity for investors. It is deducted from net income to account for the opportunity cost of using equity capital."
105,"How does residual income differ from traditional accounting measures like net income?
A. Residual income accounts for the cost of all capital, while net income does not.
B. Residual income is based on cash flows, while net income is based on accrual accounting.
C. Residual income includes only operating income, while net income includes all revenues.","A
Explanation: Residual income considers the cost of all capital (both debt and equity) used in generating income, unlike traditional net income, which does not explicitly account for the cost of equity capital."
106,"What is Economic Value Added (EVA) used for in residual income models?
A. To calculate dividends paid to shareholders
B. To measure internal corporate performance
C. To estimate future sales growth","B
Explanation: Economic Value Added (EVA) in residual income models is used to measure internal corporate performance by determining the excess return generated above the required rate of return on equity capital."
107,"How is the intrinsic value of a common stock calculated in a two-stage residual income model?
A. By multiplying the expected earnings per share by the dividend yield
B. By summing the present value of future expected residual incomes from each stage
C. By using the price-to-book ratio of the company","B
Explanation: In a two-stage residual income model, the intrinsic value of a common stock is calculated by summing the present value of expected residual incomes from each stage, including any continuing residual income."
108,"When applying residual income valuation, what determines whether a stock is overvalued or undervalued?
A. The current market price of the stock
B. The company's revenue growth rate
C. The comparison of the calculated intrinsic value with the market price","C
Explanation: In residual income valuation, a stock is considered overvalued if the calculated intrinsic value is lower than the market price and undervalued if the intrinsic value exceeds the market price."
109,"How does residual income valuation compare to dividend discount models?
A. Residual income valuation uses cash flows, while dividend discount models use earnings.
B. Residual income valuation accounts for the cost of equity, while dividend discount models do not.
C. Residual income valuation is more suitable for stable dividend-paying companies.","B
Explanation: Residual income valuation explicitly recognizes the cost of equity capital, unlike dividend discount models, which focus solely on the dividend payments without considering equity costs."
110,"What is the main strength of residual income models compared to other valuation methods?
A. They are simpler and quicker to calculate.
B. They explicitly consider the cost of all capital used in generating income.
C. They rely on historical financial data for accuracy.","B
Explanation: The main strength of residual income models is that they explicitly account for the costs of all capital, providing a more comprehensive measure of economic profit."
111,"How does continuing residual income impact the estimation of a company's value in the future?
A. It allows for higher growth rate assumptions in the residual income model.
B. It adjusts the required rate of return on equity for long-term investments.
C. It contributes to the total intrinsic value beyond the initial forecast horizon.","C
Explanation: Continuing residual income in residual income models contributes to the total intrinsic value beyond the initial forecast horizon, reflecting the company's ongoing economic profit potential."
112,"What is the purpose of calculating the implied growth rate in residual income models?
A. To estimate the company's historical growth rate.
B. To determine the required rate of return for the company's equity.
C. To reconcile the market price-to-book ratio with the expected rate of return on equity.","C
Explanation: Calculating the implied growth rate in residual income models helps reconcile the market price-to-book ratio with the expected rate of return on equity, providing insights into the market's valuation of the company."
113,"How can an analyst justify the selection of a residual income model for valuing a company's common stock?
A. By comparing the stock's historical performance with industry benchmarks.
B. By evaluating the consistency of the model's forecasts with the company's financial data.
C. By using discounted cash flow models exclusively for valuation purposes.","B
Explanation: An analyst can justify the selection of a residual income model by evaluating the consistency of the model's forecasts with the company's financial data, ensuring the model appropriately captures the company's value drivers."
114,"11. In residual income models of equity value, what does residual income represent?

   A. Net earnings after interest payments
   B. Common shareholders' opportunity cost
   C. Total capital of the company","B
   
   Explanation: Residual income in equity valuation represents the earnings remaining after deducting the opportunity cost for common shareholders. It reflects the income generated by a company that exceeds the cost of equity capital, demonstrating the value added by the company's activities specifically for common shareholders."
115,"How is economic value added (EVA) calculated in a business context?

   A. EVA = Net income - Preferred dividends
   B. EVA = Total operating income - Capital charge
   C. EVA = Earnings per share - Cost of equity capital","B
   
   Explanation: Economic value added (EVA) is calculated as the difference between total operating income (after taxes) and the capital charge, where the capital charge is determined by multiplying the invested capital by the cost of capital. EVA represents the value generated by a business above the required return on capital."
116,"When using the residual income model for valuing common stock, what does ROE represent?

    A. Return on investment
    B. Return on equity
    C. Return on assets","B

    Explanation: ROE stands for Return on Equity in the residual income model and is a key factor used to calculate the residual income. It indicates the profitability generated by a company's equity capital and is crucial in determining the excess returns attributable to common shareholders."
117,"How can an analyst determine if a stock is undervalued, fairly valued, or overvalued using the residual income model?

    A. Comparing the discount rate to the book value
    B. Calculating the intrinsic value relative to the market price
    C. Analyzing the earnings per share growth rate","B

    Explanation: An analyst can assess the valuation of a stock by comparing the calculated intrinsic value using the residual income model to the prevailing market price. If the intrinsic value is higher than the market price, the stock may be undervalued; if it's lower, it may be overvalued; and if they are similar, it could be considered fairly valued."
118,"What is the relationship between the residual income model and dividend discount models (DDM)?

    A. Residual income model is a variation of DDM
    B. Residual income is unrelated to DDM
    C. DDM and residual income model have distinct valuation approaches","C

    Explanation: The residual income model and dividend discount models (DDM) are distinct valuation approaches. While DDM focuses on the present value of expected future dividends, the residual income model emphasizes the difference between the actual earnings and the cost of equity capital to determine intrinsic value."
119,"Why is it important to consider continuing residual income in the valuation process using the residual income model?

    A. To account for one-time earnings fluctuations
    B. To assess the long-term value creation potential
    C. To adjust for changes in equity capital costs","B

    Explanation: Considering continuing residual income in the residual income model is crucial for evaluating a company's long-term value creation potential. It helps capture sustainable earnings beyond the forecast horizon and provides insights into the company's ability to generate economic profit over time."
120,"What do the terms ""single-stage"" and ""multistage"" imply in the context of residual income models?

    A. The number of investors involved in stock valuation
    B. Different approaches to calculating residual income
    C. The duration and complexity of the forecasting period","C

    Explanation: In residual income models, ""single-stage"" refers to a valuation approach where a constant growth rate is applied to residual income over a continuous forecast period. In contrast, ""multistage"" involves multiple stages with varying growth rates to account for changing company performance over time."
121,"How does the residual income model address the cost of equity capital compared to traditional accounting income statements?

    A. Deducts interest expense as a charge for equity capital
    B. Incorporates the cost of equity capital as an explicit deduction
    C. Eliminates the need for considering equity capital costs","B

    Explanation: The residual income model explicitly includes the cost of equity capital as a deduction from net income, unlike traditional accounting income statements that primarily account for debt costs through interest expense. By factoring in equity capital costs, the model provides a more comprehensive view of value creation for common shareholders."
