id,question,answer
1,"1. A financial analyst is conducting equity valuation for a company. Which of the following best defines intrinsic value?
   A. The current market price of the stock
   B. The estimated value based on future investment returns and relevant variables
   C. The liquidation value of the company","B
Explanation: Intrinsic value is the estimated value of an asset based on future investment returns, relevant variables, and a complete understanding of its investment characteristics. It represents the true worth of an asset and is used in valuation models to determine potential mispricing."
2,"When comparing absolute and relative valuation models in equity analysis, which type of model provides a point estimate of an asset's intrinsic value?
   A. Relative valuation models
   B. Sum-of-the-parts valuation
   C. Absolute valuation models","C
Explanation: Absolute valuation models, such as discounted cash flow models, provide a specific point estimate of an asset's intrinsic value based on forecasted cash flows and discount rates. Relative valuation models compare the asset's value to that of comparable assets in the market."
3,"A financial analyst is evaluating a company's stock using the method of comparables. What is the key benchmark used in this valuation approach?
   A. Average market price of similar stocks
   B. Company's historical stock price
   C. Market index price","A
Explanation: The method of comparables compares a company's stock price multiple to a benchmark price multiple derived from similar stocks in the market. This benchmark helps in assessing the relative valuation of the company."
4,"When choosing an appropriate valuation approach for a company, what are the key criteria that a financial analyst should consider?
   A. Consistency, data availability, and historical performance
   B. Company characteristics, data quality, and analyst's perspective
   C. Economic outlook, industry trends, and market competition","B
Explanation: An analyst should consider whether the chosen valuation approach aligns with the company's characteristics, the availability and quality of data, and the analyst's valuation purpose and perspective to ensure an accurate and relevant valuation."
5,"In equity valuation, what is the purpose of sensitivity analysis?
   A. Assessing industry trends and competitive positioning
   B. Analyzing the impact of changes in assumptions on valuation outcomes
   C. Identifying potential undervalued stocks in the market","B
Explanation: Sensitivity analysis helps financial analysts understand how changes in key assumptions or inputs affect the valuation output, providing insights into the potential variability and risks associated with the valuation model."
6,"An analyst is conducting a relative valuation for a company. Which of the following is an example of a relative valuation method?
   A. Discounted cash flow model
   B. Price-to-earnings ratio analysis
   C. Sum-of-the-parts valuation","B
Explanation: Price-to-earnings ratio analysis is a common relative valuation method that compares a company's stock price to its earnings per share, providing insights into how the market values the company relative to its earnings."
7,"When evaluating a conglomerate for valuation, what is the potential impact of conglomerate discounts on the overall value?
   A. Increase in value due to diversification
   B. Decrease in value due to complexity and poor performance of subsidiaries
   C. Stable value unaffected by conglomerate structure","B
Explanation: Conglomerate discounts refer to the reduction in the value of a conglomerate due to the complexity, lower transparency, and potential underperformance of its diverse business units. This discount reflects investor concerns and may lead to lower overall valuation."
8,"A financial analyst is analyzing a company for valuation purposes. What key element should be included in an effective research report to communicate valuation analysis?
   A. Personal opinions and subjective recommendations
   B. Detailed financial forecasts and historical performance data
   C. Clear rationale, assumptions, and recommendations consistent with the valuation","C
Explanation: An effective research report should clearly present the rationale behind the valuation analysis, outline key assumptions made, and provide recommendations that align with the valuation outcomes. It should focus on objective analysis rather than personal opinions."
9,"In equity valuation, what is the significance of the going concern assumption?
   A. It values the company based on asset liquidation
   B. It assumes the company will continue operating in the foreseeable future
   C. It focuses on immediate returns and profit margins","B
Explanation: The going concern assumption in valuation assumes that the company will continue its operations for the foreseeable future, considering ongoing business activities, investments, and potential growth prospects rather than valuing the company based on immediate asset liquidation."
10,"A financial analyst is analyzing a publicly traded company for valuation. Which of the following best describes fair value in the context of valuation?
    A. Market price during a liquidation event
    B. Price at which assets are sold in distress situations
    C. Price at which an asset would change hands in an informed, non-compelled transaction","C
Explanation: Fair value represents the price at which an asset or liability would change hands in a transaction between knowledgeable, willing parties who are not under compulsion to buy or sell, reflecting all relevant information and considerations at that time. It is a key concept in determining the intrinsic worth of assets in valuation analysis."
11,"11. Which of the following best describes the concept of intrinsic value in equity valuation?

A. The current market price of the asset
B. Theoretical value based on fundamental analysis
C. Historical cost of acquiring the asset","B

Explanation: Intrinsic value refers to the theoretical worth of an asset based on fundamental analysis, taking into account factors such as cash flows, growth prospects, risk, and discount rates. It is distinct from the market price or historical cost and serves as a benchmark for determining whether an asset is undervalued or overvalued."
12,"When conducting industry and competitive analysis as part of equity valuation, what key questions should an analyst address?

A. How does the company's stock price compare to industry peers?
B. What are the company's financial statements' figures over the past year?
C. How does the company differentiate itself in the market, and what are the industry trends affecting its performance?","C

Explanation: Industry and competitive analysis involve understanding how a company fits within its industry landscape, including market positioning, competitive advantages, and industry trends that could impact future performance. It goes beyond simple financial comparisons to consider broader market dynamics."
13,"Contrast absolute and relative valuation models used in equity analysis.

A. Absolute valuation methods rely on comparing metrics to peers, while relative valuation models involve estimating intrinsic value based on cash flows.
B. Absolute valuation models estimate an asset's intrinsic value directly, while relative valuation models compare the asset to similar assets in the market.
C. Absolute valuation approaches are more suitable for startups, while relative valuation is preferred for established companies.","B

Explanation: Absolute valuation models, like discounted cash flow analysis, directly estimate the intrinsic value of an asset based on its projected cash flows. In contrast, relative valuation models compare the asset to similar assets in the market using metrics like price multiples to determine if it is undervalued or overvalued relative to its peers."
14,"What does a conglomerate discount refer to in the context of sum-of-the-parts valuation?

A. The premium paid for a diversified company compared to its standalone divisions
B. The discount applied to a conglomerate's stock price because of lack of focus or complexity
C. The additional value gained from diversification within a conglomerate's business segments","B

Explanation: A conglomerate discount is a reduction in a company's stock price due to the perceived inefficiency or complexity of managing diverse business segments under one entity. Investors often assign a lower value to conglomerates, leading to this discount when compared to the sum of their individual parts' standalone values."
15,"When choosing an appropriate valuation approach for a company, what are the key criteria to consider?

A. Historical performance and industry benchmarking
B. Consistency with company characteristics, data availability, and valuation purpose
C. Market trends and analyst consensus recommendations","B

Explanation: The criteria for selecting a valuation approach include ensuring it aligns with the company's specific characteristics, the quality and availability of data, and the purpose of the valuation. A suitable approach should be consistent with these factors to produce a relevant and accurate valuation."
16,"In the valuation process, what is the purpose of sensitivity analysis?

A. Identifying potential outliers in financial data
B. Analyzing market trends to forecast future performance
C. Evaluating how changes in assumptions affect the valuation outcome","C

Explanation: Sensitivity analysis assesses how variations in key input assumptions impact the valuation results. By testing different scenarios and assumptions, analysts can understand the valuation's sensitivity to changes and identify the most critical factors driving the asset's value."
17,"How do control premiums and discounts for lack of marketability affect the valuation of a company?

A. Control premiums increase the valuation, while marketability discounts decrease it
B. Control premiums decrease the valuation, while marketability discounts increase it
C. Both control premiums and marketability discounts result in neutral valuation effects","A

Explanation: Control premiums represent the additional value paid for a controlling interest in a company, thus increasing the valuation. On the other hand, discounts for lack of marketability reduce an asset's value due to the illiquidity or limited marketability of the investment, leading to a decrease in valuation."
18,"When preparing an effective research report in equity analysis, why is it essential to distinguish between facts and opinions?

A. To limit the report's length and complexity
B. To ensure clarity and transparency for readers
C. To enhance the report's visual appeal","B

Explanation: Distinguishing between facts and opinions in a research report is crucial for maintaining transparency and credibility. It helps readers understand the basis for recommendations, assess the validity of conclusions, and differentiate between objective information and subjective interpretations, increasing the report's overall clarity and reliability."
19,"What is the primary objective of communicating valuation analysis effectively as an equity analyst?

A. To impress clients with technical expertise
B. To provide clear rationale and recommendations based on analysis
C. To use complex jargon to demonstrate industry knowledge","B

Explanation: The key goal of effective communication in valuation analysis is to provide a clear and coherent explanation of the analysis, supporting rationale, and resulting recommendations. By articulating complex concepts in a concise and understandable manner, analysts ensure that clients can make informed decisions based on the valuation findings."
20,"How does the intrinsic value of an asset align with the going concern assumption in equity valuation?

A. Intrinsic value is higher under the going concern assumption
B. Intrinsic value is lower under the going concern assumption
C. Intrinsic value does not consider the going concern assumption","A

Explanation: Intrinsic value considers the asset's value with the assumption that the company will continue its operations as a going concern. This assumption implies that the business will operate indefinitely, allowing for the realization of projected cash flows and attributing a higher value to the asset compared to a liquidation scenario."
21,"11. Which of the following best describes the concept of intrinsic value in equity valuation?

    A. The market price of a security at a given point in time
    B. The hypothetical value of an asset based on a comprehensive understanding of its investment characteristics
    C. The total assets value minus the total liabilities value of a company","B

Explanation: Intrinsic value refers to the theoretical or true value of an asset based on a detailed understanding of its investment characteristics. It considers factors beyond just the market price at a specific moment and aims to determine the underlying value of the asset itself."
22,"When it comes to equity valuation, what is the importance of industry knowledge for an analyst?

    A. Industry knowledge is irrelevant in equity valuation analyses
    B. Industry knowledge helps the analyst assess a company's competitive position and future prospects
    C. Industry knowledge is primarily used in financial statement analysis","B

Explanation: Industry knowledge is crucial for equity analysts as it enables them to understand a company's competitive position within its sector, assess industry trends, and make more accurate forecasts about the company's future performance based on the broader industry landscape."
23,"In the context of equity valuation models, what do absolute valuation models focus on?

    A. Comparing a company's valuation to that of its peers
    B. Estimating the intrinsic value of an asset independent of market prices
    C. Valuing a company based on its growth potential","B

Explanation: Absolute valuation models aim to estimate the intrinsic value of an asset or company independent of its market price. These models typically involve discounted cash flow analysis or other methods that focus on the underlying fundamentals of the business."
24,"When selecting an appropriate approach for valuing a company, what are some important criteria to consider?

    A. The popularity of the valuation model in the industry
    B. Consistency with the company's stock price history
    C. Alignment with the company's characteristics, available data, and the analyst's purpose","C

Explanation: When choosing a valuation approach, it is essential to consider factors such as how well the model aligns with the specific characteristics of the company being valued, the quality and availability of data, and the analyst's purpose or perspective in conducting the valuation."
25,"What is the primary purpose of sensitivity analysis in the valuation process?

    A. To adjust for macroeconomic factors impacting the company
    B. To evaluate how changes in input assumptions affect the valuation outcome
    C. To determine the optimal timing for buying or selling a stock","B

Explanation: Sensitivity analysis in valuation helps analysts understand how variations in key assumptions or inputs affect the resulting valuation outcome. It allows for a better assessment of the potential impact of changes in variables on the asset's value."
26,"How does sum-of-the-parts valuation differ from traditional valuation methods?

    A. Sum-of-the-parts valuation only considers the current market price of a stock
    B. It values a company based on the aggregate value of its individual business segments
    C. Traditional valuation methods focus on relative comparisons to industry benchmarks","B

Explanation: Sum-of-the-parts valuation involves valuing a company based on the combined value of its individual business segments or divisions. This method provides a more granular view of a company's total worth compared to traditional valuation approaches."
27,"In equity valuation, what does the term ""conglomerate discount"" refer to?

    A. A premium applied to companies with diverse business lines
    B. A discount that reflects the lower overall value of diversified conglomerates
    C. An increase in stock price due to industry consolidation","B

Explanation: A conglomerate discount represents the reduction in the overall value of a diversified conglomerate as compared to the sum of the individual parts if they were valued separately. It is often observed when investors believe that conglomerates are less attractive than focused companies."
28,"When should an analyst consider using a relative valuation model instead of an absolute valuation model?

    A. When the company's future cash flows are difficult to predict
    B. When the company has stable and predictable earnings
    C. When comparing the company to industry peers is the main focus","C

Explanation: Relative valuation models are often preferred when comparing a company to its industry peers or benchmarking against comparable firms. These models use market multiples and price ratios to assess a company's value relative to others in the same industry or sector."
29,"How do equity analysts typically communicate their valuation analysis in an effective research report?

    A. By focusing solely on qualitative insights and recommendations
    B. By including a comprehensive analysis, forecasts, valuation, and a clear recommendation
    C. By avoiding the disclosure of any potential conflicts of interest","B

Explanation: Effective research reports from equity analysts should include a thorough analysis of the company, financial forecasts, the valuation methodology employed, and a clear recommendation based on the valuation results. Transparency, objectivity, and thoroughness are key elements of a well-structured research report."
30,"In the context of equity valuation, what role does the going concern assumption play?

    A. It focuses on liquidation value rather than ongoing operations
    B. It assumes the company will continue operating for the foreseeable future
    C. It discounts future cash flows to present value","B

Explanation: The going concern assumption in equity valuation assumes that the company will continue its operations for the foreseeable future. This assumption is important as it influences how analysts assess the company's long-term sustainability and future value based on ongoing operations."
31,"11. Which of the following best describes the concept of intrinsic value in equity valuation?

A. The current market price of a stock
B. The hypothetical value based on perceived investment characteristics
C. The liquidation value of a company's assets","B

Explanation: Intrinsic value in equity valuation refers to the estimated value of an asset based on a thorough understanding of its investment characteristics. It is not necessarily the same as the current market price or the liquidation value, as it reflects the true worth of the asset considering its potential for future investment returns."
32,"What is the primary assumption underlying intrinsic value in equity valuation?

A. Market price always reflects true value
B. Assets should be valued based on external market factors
C. Company will continue to operate as a going concern","C

Explanation: The primary assumption underlying intrinsic value is that the company will continue to operate as a going concern in the foreseeable future. This assumption is important for estimating the true value of the company's assets and operations."
33,"When choosing an appropriate approach for valuing a company, what criteria should be considered?

A. Consistency with analyst's personal preference
B. Use of complex and novel valuation methods
C. Consistency with company characteristics and available data","C

Explanation: When selecting a valuation approach, it is crucial to consider factors such as the characteristics of the company being valued, the quality and availability of data, and how well the chosen approach aligns with the specific company's attributes."
34,"What is the fundamental difference between absolute and relative valuation models?

A. Absolute valuation models base value on market multiples, while relative models use discounted cash flows.
B. Absolute valuation models derive intrinsic value, while relative models compare to similar assets in the market.
C. Absolute valuation models rely on past performance, while relative models forecast future returns.","B

Explanation: Absolute valuation models aim to calculate the intrinsic value of an asset, providing a specific value estimate. In contrast, relative valuation models compare the asset's value to similar assets in the market, based on metrics like price multiples."
35,"How does sensitivity analysis contribute to the valuation process?

A. Determines the impact of changes in input assumptions on the analysis outcome
B. Aligns valuation results with short-term market trends
C. Quantifies industry competitiveness in the valuation model","A

Explanation: Sensitivity analysis in valuation helps assess the effect of variations in input assumptions on the final valuation outcome. It aids in understanding the robustness of the valuation model by examining how changes in key inputs influence the valuation results."
36,"In the context of valuation, what are situational adjustments?

A. Changes made to historical financial statements to reflect current market conditions
B. Adjustments for market volatility that impact asset prices
C. Corrections for factors like control premiums, lack of marketability discounts, and illiquidity discounts","C

Explanation: Situational adjustments in valuation involve accounting for factors such as control premiums (for controlling interests), discounts for lack of marketability, and discounts for illiquidity. These adjustments account for unique circumstances that affect the value of an asset."
37,"In equity valuation, what is the purpose of applying conclusions drawn from the valuation analysis?

A. To create financial reports for regulatory compliance
B. To recommend investment strategies and provide actionable insights
C. To maintain consistent profit margins for the company","B

Explanation: The primary purpose of applying conclusions from valuation analysis is to offer investment recommendations, insights, and strategies based on the estimated intrinsic value of the asset. These recommendations guide stakeholders in making informed decisions."
38,"When preparing a research report for equity analysis, what role does ethics play in communication?

A. Ethics dictate the use of technical jargon to maintain professionalism
B. Ethical standards ensure transparency, objectivity, and clear disclosure of key assumptions
C. Ethics limit the level of detail provided in the report to avoid overwhelming readers","B

Explanation: Ethics in equity research reports emphasize the importance of transparency, objectivity, and clear disclosure of key assumptions. This ensures that the information presented is fair, accurate, and aids in building trust with stakeholders."
39,"How does a financial analyst demonstrate accountability in conducting valuations?

A. By maximizing shareholder profits through aggressive financial modeling
B. By adhering to professional standards of competence and conduct
C. By prioritizing personal interests over client needs during the valuation process","B

Explanation: Financial analysts demonstrate accountability by upholding professional standards of competence and conduct throughout the valuation process. Following ethical guidelines and being transparent in their analyses fosters trust and credibility in their work."
40,"In equity valuation, why is it essential to distinguish between facts and opinions in a research report?

A. To highlight personal biases and opinions for transparency
B. To minimize legal liabilities in case of inaccurate recommendations
C. To provide a clear distinction between verifiable facts and subjective interpretations","C

Explanation: Distinguishing between facts and opinions in a research report is crucial to provide readers with a clear understanding of what information is objectively verifiable (facts) and what represents the analyst's subjective viewpoints (opinions). This clarity enhances the report's credibility and the basis for investment decisions."
41,"11. Which of the following best describes the concept of intrinsic value in equity valuation?

A. The market price at which an asset is currently trading
B. The perceived value of an asset based on future investment returns
C. The liquidation value of an asset if it were dissolved and sold individually","B

Explanation: Intrinsic value represents the true value of an asset based on its investment characteristics and future expected returns. It is distinct from the current market price and the liquidation value, as it focuses on the underlying fundamentals and cash flows of the asset."
42,"What role does the assumption of a going concern play in determining the value of a company?

A. It provides a benchmark for liquidation value calculations
B. It assumes the company will continue operating in the foreseeable future
C. It adjusts the cash flows for immediate liquidation scenarios","B

Explanation: The going concern assumption in valuation implies that the company will continue its operations for the foreseeable future, considering its ongoing business activities, growth prospects, and sustainability, which is essential in determining its intrinsic value."
